<?xml version="1.0" encoding="UTF-8"?>
<TEI xmlns="http://www.tei-c.org/ns/1.0">
    <teiHeader>
        <fileDesc>
            <titleStmt>
                <title>Title</title>
            </titleStmt>
            <publicationStmt>
                <p>Publication Information</p>
            </publicationStmt>
            <sourceDesc>
                <p>Information about the source</p>
            </sourceDesc>
        </fileDesc>
    </teiHeader>
    <text>
        <body>
            <list>
                <item>
                    <stage>(ODPRTI DEL SEJE JE BIL PREKINJEN 29. JUNIJA 2000 OB 15.59 URI.)</stage>
                    <idno>SDZ2-Izredna-51-2000-06-29.stage8</idno>
                </item>
                <item>
                    <stage>(Odprta seja za javnost je bila prekinjena ob 14.18 uri in se je nadaljevala ob 14.58 uri.)</stage>
                    <idno>SDZ2-Izredna-14-1997-09-25.stage34</idno>
                </item>
                <item>
                    <stage>(Odprti del seje je bil prekinjen ob 17.48 uri in se je nadaljeval ob 18.05 uri.)</stage>
                    <idno>SDZ2-Redna-14-1999-05-27.stage145</idno>
                </item>
                <item>
                    <stage>(PREKINITEV ODPRTEGA DELA SEJE.)</stage>
                    <idno>SDZ2-Izredna-27-1998-10-22.stage43</idno>
                </item>
            <item>
               <stage>(SEJA JE BILA PREKINJA 4. FEBRUARJA 1999 OB 16.58 URI.)</stage>
               <idno>SDZ2-Izredna-32-1999-02-04.stage36</idno>
            </item>
            <item>
               <stage>(SEJA JE BILA PREKINJENA 1. APRILA 1998 OB 19.33 URI.)</stage>
               <idno>SDZ2-Redna-08-1998-04-01.stage39</idno>
            </item>
            <item>
               <stage>(SEJA JE BILA PREKINJENA 1. DECEMBRA 1999 OB 17.59 URI.)</stage>
               <idno>SDZ2-Redna-17-1999-12-01.stage113</idno>
            </item>
            <item>
               <stage>(SEJA JE BILA PREKINJENA 1. JULIJA 1997 OB 18.04 URI.)</stage>
               <idno>SDZ2-Redna-06-1997-07-01.stage90</idno>
            </item>
            <item>
               <stage>(SEJA JE BILA PREKINJENA 1. JUNIJA 2000 OB 18.03 URI.)</stage>
               <idno>SDZ2-Izredna-49-2000-06-01.stage553</idno>
            </item>
            <item>
               <stage>(SEJA JE BILA PREKINJENA 1. OKTOBRA 1997 OB 18.08 URI.)</stage>
               <idno>SDZ2-Izredna-15-1997-10-01.stage25</idno>
            </item>
            <item>
               <stage>(SEJA JE BILA PREKINJENA 1. OKTOBRA 1998 OB 16.53 URI.)</stage>
               <idno>SDZ2-Izredna-25-1998-10-01.stage48</idno>
            </item>
            <item>
               <stage>(SEJA JE BILA PREKINJENA 1. OKTOBRA 1999 OB 13.51 URI.)</stage>
               <idno>SDZ2-Redna-16-1999-10-01.stage45</idno>
            </item>
            <item>
               <stage>(SEJA JE BILA PREKINJENA 1. SEPTEMBRA 2000 OB 13.20 URI.)</stage>
               <idno>SDZ2-Izredna-54-2000-09-01.stage111</idno>
            </item>
            <item>
               <stage>(SEJA JE BILA PREKINJENA 10. DECEMBRA 1997 OB 20.12 URI.)</stage>
               <idno>SDZ2-Izredna-16-1997-12-10.stage40</idno>
            </item>
            <item>
               <stage>(SEJA JE BILA PREKINJENA 10. DECEMBRA 1999 OB 14.33 URI.)</stage>
               <idno>SDZ2-Redna-17-1999-12-10.stage331</idno>
            </item>
            <item>
               <stage>(SEJA JE BILA PREKINJENA 10. FEBRUARJA 1999 OB 18.05 URI.)</stage>
               <idno>SDZ2-Izredna-32-1999-02-10.stage22</idno>
            </item>
            <item>
               <stage>(SEJA JE BILA PREKINJENA 10. JULIJA 1997 OB 20.09 URI.)</stage>
               <idno>SDZ2-Izredna-09-1997-07-10.stage175</idno>
            </item>
            <item>
               <stage>(SEJA JE BILA PREKINJENA 10. JULIJA 1998 OB 14.05 URI)</stage>
               <idno>SDZ2-Izredna-23-1998-07-10.stage138</idno>
            </item>
            <item>
               <stage>(SEJA JE BILA PREKINJENA 10. JUNIJA 1998 OB 17.36 URI.)</stage>
               <idno>SDZ2-Redna-09-1998-06-10.stage100</idno>
            </item>
            <item>
               <stage>(SEJA JE BILA PREKINJENA 10. MAJA 2000 OB 17.57 URI.)</stage>
               <idno>SDZ2-Redna-21-2000-05-10.stage330</idno>
            </item>
            <item>
               <stage>(SEJA JE BILA PREKINJENA 10. NOVEMBRA 1998 OB 17.58 URI.)</stage>
               <idno>SDZ2-Izredna-28-1998-11-10.stage18</idno>
            </item>
            <item>
               <stage>(SEJA JE BILA PREKINJENA 11. DECEMBRA 1997 OB 19.33 URI.)</stage>
               <idno>SDZ2-Izredna-16-1997-12-11.stage28</idno>
            </item>
            <item>
               <stage>(SEJA JE BILA PREKINJENA 11. FEBRUARJA 2000 OB 13.54 URI.)</stage>
               <idno>SDZ2-Redna-18-2000-02-11.stage417</idno>
            </item>
            <item>
               <stage>(SEJA JE BILA PREKINJENA 11. JUNIJA 1997 OB 18.28 URI.)</stage>
               <idno>SDZ2-Redna-05-1997-06-11.stage506</idno>
            </item>
            <item>
               <stage>(SEJA JE BILA PREKINJENA 11. JUNIJA 1998 OB 17.51 URI.)</stage>
               <idno>SDZ2-Redna-09-1998-06-11.stage155</idno>
            </item>
            <item>
               <stage>(SEJA JE BILA PREKINJENA 11. MAJA 1999 OB 18.48 URI.)</stage>
               <idno>SDZ2-Redna-13-1999-05-11.stage458</idno>
            </item>
            <item>
               <stage>(SEJA JE BILA PREKINJENA 11. MARCA 1999 OB 19.24 URI.)</stage>
               <idno>SDZ2-Redna-11-1999-03-11.stage209</idno>
            </item>
            <item>
               <stage>(SEJA JE BILA PREKINJENA 11. SEPTEMBRA 1997 OB 18.02 URI.)</stage>
               <idno>SDZ2-Redna-06-1997-09-11.stage178</idno>
            </item>
            <item>
               <stage>(SEJA JE BILA PREKINJENA 11.5.2000 OB 16.52 URI.)</stage>
               <idno>SDZ2-Redna-21-2000-05-11.stage191</idno>
            </item>
            <item>
               <stage>(SEJA JE BILA PREKINJENA 11.7.2000 OB 18.24 URI.)</stage>
               <idno>SDZ2-Izredna-52-2000-07-11.stage67</idno>
            </item>
            <item>
               <stage>(SEJA JE BILA PREKINJENA 12. DECEMBRA 1997 OB 14.07 URI.)</stage>
               <idno>SDZ2-Redna-07-1997-12-12.stage10</idno>
            </item>
            <item>
               <stage>(SEJA JE BILA PREKINJENA 12. JULIJA 2000 OB 17.25 URI.)</stage>
               <idno>SDZ2-Izredna-52-2000-07-12.stage47</idno>
            </item>
            <item>
               <stage>(SEJA JE BILA PREKINJENA 12. MARCA 1998 OB 17.55 URI.)</stage>
               <idno>SDZ2-Redna-08-1998-03-12.stage387</idno>
            </item>
            <item>
               <stage>(SEJA JE BILA PREKINJENA 12. NOVEMBRA 1998 OB 17.13 URI.)</stage>
               <idno>SDZ2-Redna-10-1998-11-12.stage231</idno>
            </item>
            <item>
               <stage>(SEJA JE BILA PREKINJENA 12. OKTOBRA 1999 OB 18.01 URI.)</stage>
               <idno>SDZ2-Redna-16-1999-10-12.stage84</idno>
            </item>
            <item>
               <stage>(SEJA JE BILA PREKINJENA 13. JANUARJA 1999 OB 18.11 URI.)</stage>
               <idno>SDZ2-Redna-10-1999-01-13.stage834</idno>
            </item>
            <item>
               <stage>(SEJA JE BILA PREKINJENA 13. MAJA 1997 OB 17.30 URI.)</stage>
               <idno>SDZ2-Redna-04-1997-05-13.stage206</idno>
            </item>
            <item>
               <stage>(SEJA JE BILA PREKINJENA 13. MAJA 1999 OB 18.06 URI.)</stage>
               <idno>SDZ2-Redna-13-1999-05-13.stage196</idno>
            </item>
            <item>
               <stage>(SEJA JE BILA PREKINJENA 13. MARCA 1998 OB 16.08 URI.)</stage>
               <idno>SDZ2-Izredna-20-1998-03-13.stage67</idno>
            </item>
            <item>
               <stage>(SEJA JE BILA PREKINJENA 13. OKTOBRA 1998 OB 17.39 URI.)</stage>
               <idno>SDZ2-Izredna-25-1998-10-13.stage14</idno>
            </item>
            <item>
               <stage>(SEJA JE BILA PREKINJENA 13. SEPTEMBRA 2000 OB 17.45 URI.)</stage>
               <idno>SDZ2-Izredna-55-2000-09-13.stage158</idno>
            </item>
            <item>
               <stage>(SEJA JE BILA PREKINJENA 13.7.1999 OB 18.20 URI.)</stage>
               <idno>SDZ2-Izredna-37-1999-07-13.stage240</idno>
            </item>
            <item>
               <stage>(SEJA JE BILA PREKINJENA 13.7.2000 OB 19.25 URI.)</stage>
               <idno>SDZ2-Izredna-52-2000-07-13.stage328</idno>
            </item>
            <item>
               <stage>(SEJA JE BILA PREKINJENA 14. APRILA 2000 OB 11.54 URI.)</stage>
               <idno>SDZ2-Redna-21-2000-04-14.stage187</idno>
            </item>
            <item>
               <stage>(SEJA JE BILA PREKINJENA 14. DECEMBRA 1999 OB 18.03 URI.)</stage>
               <idno>SDZ2-Redna-17-1999-12-14.stage180</idno>
            </item>
            <item>
               <stage>(SEJA JE BILA PREKINJENA 14. JANUARJA 1999 OB 17.51 URI.)</stage>
               <idno>SDZ2-Redna-10-1999-01-14.stage133</idno>
            </item>
            <item>
               <stage>(SEJA JE BILA PREKINJENA 14. JUNIJA 2000 OB 13.47 URI.)</stage>
               <idno>SDZ2-Izredna-52-2000-07-14.stage182</idno>
            </item>
            <item>
               <stage>(SEJA JE BILA PREKINJENA 14. MAJA 1998 OB 17.40 URI.)</stage>
               <idno>SDZ2-Izredna-22-1998-05-14.stage66</idno>
            </item>
            <item>
               <stage>(SEJA JE BILA PREKINJENA 14. OKTOBRA 1998 OB 17.29 URI.)</stage>
               <idno>SDZ2-Izredna-25-1998-10-14.stage37</idno>
            </item>
            <item>
               <stage>(SEJA JE BILA PREKINJENA 14.7.1999 OB 18.57 URI.)</stage>
               <idno>SDZ2-Izredna-37-1999-07-14.stage77</idno>
            </item>
            <item>
               <stage>(SEJA JE BILA PREKINJENA 15. APRILA 1998 OB 18.12 URI)</stage>
               <idno>SDZ2-Izredna-21-1998-04-15.stage313</idno>
            </item>
            <item>
               <stage>(SEJA JE BILA PREKINJENA 15. DECEMBRA 1999 OB 17.38 URI.)</stage>
               <idno>SDZ2-Redna-17-1999-12-15.stage179</idno>
            </item>
            <item>
               <stage>(SEJA JE BILA PREKINJENA 15. FEBRUARJA 2000 OB 17.50 URI.)</stage>
               <idno>SDZ2-Redna-18-2000-02-15.stage213</idno>
            </item>
            <item>
               <stage>(SEJA JE BILA PREKINJENA 15. JULIJA 1998 OB 18.07 URI.)</stage>
               <idno>SDZ2-Izredna-23-1998-07-15.stage32</idno>
            </item>
            <item>
               <stage>(SEJA JE BILA PREKINJENA 15. OKTOBRA 1998 OB 17.17 URI.)</stage>
               <idno>SDZ2-Izredna-25-1998-10-15.stage140</idno>
            </item>
            <item>
               <stage>(SEJA JE BILA PREKINJENA 15.6.1999 OB 17.56 URI.)</stage>
               <idno>SDZ2-Redna-15-1999-06-15.stage206</idno>
            </item>
            <item>
               <stage>(SEJA JE BILA PREKINJENA 16. DECEMBRA 1999 OB 17.56 URI.)</stage>
               <idno>SDZ2-Redna-17-1999-12-16.stage20</idno>
            </item>
            <item>
               <stage>(SEJA JE BILA PREKINJENA 16. JULIJA 1998 OB 17.39 URI.)</stage>
               <idno>SDZ2-Izredna-23-1998-07-16.stage237</idno>
            </item>
            <item>
               <stage>(SEJA JE BILA PREKINJENA 16. JUNIJA 1998 OB 18.04 URI.)</stage>
               <idno>SDZ2-Redna-09-1998-06-16.stage115</idno>
            </item>
            <item>
               <stage>(SEJA JE BILA PREKINJENA 16. JUNIJA 1999 OB 18.03 URI.)</stage>
               <idno>SDZ2-Redna-15-1999-06-16.stage343</idno>
            </item>
            <item>
               <stage>(SEJA JE BILA PREKINJENA 16. MAJA 1997 OB 12.35 URI.)</stage>
               <idno>SDZ2-Redna-04-1997-05-16.stage86</idno>
            </item>
            <item>
               <stage>(SEJA JE BILA PREKINJENA 16. MARCA 2000 OB 18.09 URI.)</stage>
               <idno>SDZ2-Redna-19-2000-03-16.stage437</idno>
            </item>
            <item>
               <stage>(SEJA JE BILA PREKINJENA 16. NOVEMBRA 1999 OB 17.45 URI.)</stage>
               <idno>SDZ2-Redna-17-1999-11-16.stage92</idno>
            </item>
            <item>
               <stage>(SEJA JE BILA PREKINJENA 16. OKTOBRA 1998 OB 12.25 URI.)</stage>
               <idno>SDZ2-Izredna-26-1998-10-16.stage6</idno>
            </item>
            <item>
               <stage>(SEJA JE BILA PREKINJENA 16. SEPTEMBRA 1998 OB 18.01 URI.)</stage>
               <idno>SDZ2-Izredna-24-1998-09-16.stage57</idno>
            </item>
            <item>
               <stage>(SEJA JE BILA PREKINJENA 17. DECEMBRA 1997 OB 17.05 URI.)</stage>
               <idno>SDZ2-Izredna-17-1997-12-17.stage291</idno>
            </item>
            <item>
               <stage>(SEJA JE BILA PREKINJENA 17. DECEMBRA 1998 OB 18.00 URI.)</stage>
               <idno>SDZ2-Izredna-30-1998-12-17.stage299</idno>
            </item>
            <item>
               <stage>(SEJA JE BILA PREKINJENA 17. DECEMBRA 1999 OB 14.01 URI.)</stage>
               <idno>SDZ2-Redna-17-1999-12-17.stage85</idno>
            </item>
            <item>
               <stage>(SEJA JE BILA PREKINJENA 17. FEBRUARJA 2000 OB 18.00 URI.)</stage>
               <idno>SDZ2-Redna-18-2000-02-17.stage167</idno>
            </item>
            <item>
               <stage>(SEJA JE BILA PREKINJENA 17. JULIJA 1998 OB 13.41 URI.)</stage>
               <idno>SDZ2-Izredna-23-1998-07-17.stage117</idno>
            </item>
            <item>
               <stage>(SEJA JE BILA PREKINJENA 17. JUNIJA 1998 OB 17.27 URI.)</stage>
               <idno>SDZ2-Redna-09-1998-06-17.stage362</idno>
            </item>
            <item>
               <stage>(SEJA JE BILA PREKINJENA 17. MARCA 1998 OB 18.01 URI.)</stage>
               <idno>SDZ2-Izredna-20-1998-03-17.stage35</idno>
            </item>
            <item>
               <stage>(SEJA JE BILA PREKINJENA 17. MARCA 2000 OB 14.01 URI.)</stage>
               <idno>SDZ2-Redna-19-2000-03-17.stage154</idno>
            </item>
            <item>
               <stage>(SEJA JE BILA PREKINJENA 17. NOVEMBRA 1999 OB 17.56 URI.)</stage>
               <idno>SDZ2-Redna-17-1999-11-17.stage57</idno>
            </item>
            <item>
               <stage>(SEJA JE BILA PREKINJENA 17. SEPTEMBRA 1998 OB 20.49 URI.)</stage>
               <idno>SDZ2-Izredna-24-1998-09-17.stage223</idno>
            </item>
            <item>
               <stage>(SEJA JE BILA PREKINJENA 17.6.1999 OB 17.58 URI.)</stage>
               <idno>SDZ2-Redna-15-1999-06-17.stage114</idno>
            </item>
            <item>
               <stage>(SEJA JE BILA PREKINJENA 18. DECEMBRA 1997 OB 19.55. URI.)</stage>
               <idno>SDZ2-Izredna-17-1997-12-18.stage455</idno>
            </item>
            <item>
               <stage>(SEJA JE BILA PREKINJENA 18. DECEMBRA 1998 OB 14.10 URI.)</stage>
               <idno>SDZ2-Izredna-30-1998-12-18.stage78</idno>
            </item>
            <item>
               <stage>(SEJA JE BILA PREKINJENA 18. FEBRUARJA 1998 OB 17.56 URI.)</stage>
               <idno>SDZ2-Redna-08-1998-02-18.stage194</idno>
            </item>
            <item>
               <stage>(SEJA JE BILA PREKINJENA 18. JANUARJA 2000 OB 16.53 URI.)</stage>
               <idno>SDZ2-Izredna-43-2000-01-18.stage42</idno>
            </item>
            <item>
               <stage>(SEJA JE BILA PREKINJENA 18. JULIJA 2000 OB 17.59 URI.)</stage>
               <idno>SDZ2-Izredna-52-2000-07-18.stage489</idno>
            </item>
            <item>
               <stage>(SEJA JE BILA PREKINJENA 18. JUNIJA 1998 OB 17.58 URI.)</stage>
               <idno>SDZ2-Redna-09-1998-06-18.stage151</idno>
            </item>
            <item>
               <stage>(SEJA JE BILA PREKINJENA 18. MARCA 1998 OB 18.04 URI.)</stage>
               <idno>SDZ2-Redna-08-1998-03-18.stage224</idno>
            </item>
            <item>
               <stage>(SEJA JE BILA PREKINJENA 18. NOVEMBRA 1997 OB 18.03 URI.)</stage>
               <idno>SDZ2-Redna-07-1997-11-18.stage249</idno>
            </item>
            <item>
               <stage>(SEJA JE BILA PREKINJENA 18. NOVEMBRA 1999 OB 18.00 URI.)</stage>
               <idno>SDZ2-Redna-17-1999-11-18.stage130</idno>
            </item>
            <item>
               <stage>(SEJA JE BILA PREKINJENA 18.6.1999 OB 14.01 URI.)</stage>
               <idno>SDZ2-Redna-15-1999-06-18.stage41</idno>
            </item>
            <item>
               <stage>(SEJA JE BILA PREKINJENA 19. APRILA 2000 OB 13.06 URI.)</stage>
               <idno>SDZ2-Redna-21-2000-04-19.stage341</idno>
            </item>
            <item>
               <stage>(SEJA JE BILA PREKINJENA 19. FEBRUARJA 1998 OB 17.55 URI.)</stage>
               <idno>SDZ2-Redna-08-1998-02-19.stage36</idno>
            </item>
            <item>
               <stage>(SEJA JE BILA PREKINJENA 19. FEBRUARJA 1999 OB 13.59 URI.)</stage>
               <idno>SDZ2-Redna-11-1999-02-19.stage23</idno>
            </item>
            <item>
               <stage>(SEJA JE BILA PREKINJENA 19. JANUARJA 2000 OB 18.32 URI.)</stage>
               <idno>SDZ2-Izredna-43-2000-01-19.stage390</idno>
            </item>
            <item>
               <stage>(SEJA JE BILA PREKINJENA 19. JUNIJA 1998 OB 13.43 URI.)</stage>
               <idno>SDZ2-Redna-09-1998-06-19.stage97</idno>
            </item>
            <item>
               <stage>(SEJA JE BILA PREKINJENA 19. MAJA 1998 OB 18.03 URI.)</stage>
               <idno>SDZ2-Redna-09-1998-05-19.stage95</idno>
            </item>
            <item>
               <stage>(SEJA JE BILA PREKINJENA 19. MARCA 1998 OB 12.54 URI.)</stage>
               <idno>SDZ2-Redna-08-1998-03-19.stage164</idno>
            </item>
            <item>
               <stage>(SEJA JE BILA PREKINJENA 19. MARCA 1998 OB 17.26 URI.)</stage>
               <idno>SDZ2-Izredna-20-1998-03-19.stage15</idno>
            </item>
            <item>
               <stage>(SEJA JE BILA PREKINJENA 19. NOVEMBER 1999 OB 13.42 URI.)</stage>
               <idno>SDZ2-Redna-17-1999-11-19.stage109</idno>
            </item>
            <item>
               <stage>(SEJA JE BILA PREKINJENA 19. NOVEMBRA 1997 OB 17.58 URI.)</stage>
               <idno>SDZ2-Redna-07-1997-11-19.stage183</idno>
            </item>
            <item>
               <stage>(SEJA JE BILA PREKINJENA 19. OKTOBRA 1999 OB 17.53 URI.)</stage>
               <idno>SDZ2-Redna-16-1999-10-19.stage61</idno>
            </item>
            <item>
               <stage>(SEJA JE BILA PREKINJENA 19.7.2000 OB 17.59 URI.)</stage>
               <idno>SDZ2-Izredna-52-2000-07-19.stage455</idno>
            </item>
            <item>
               <stage>(SEJA JE BILA PREKINJENA 2. APRILA 1998 OB 18.00 URI.)</stage>
               <idno>SDZ2-Redna-08-1998-04-02.stage258</idno>
            </item>
            <item>
               <stage>(SEJA JE BILA PREKINJENA 2. DECEMBRA 1997 OB 20.53 URI.)</stage>
               <idno>SDZ2-Izredna-16-1997-12-02.stage198</idno>
            </item>
            <item>
               <stage>(SEJA JE BILA PREKINJENA 2. DECEMBRA 1999 OB 18.00 URI.)</stage>
               <idno>SDZ2-Redna-17-1999-12-02.stage168</idno>
            </item>
            <item>
               <stage>(SEJA JE BILA PREKINJENA 2. FEBRUARJA 2000 OB 18.00 URI.)</stage>
               <idno>SDZ2-Redna-18-2000-02-02.stage16</idno>
            </item>
            <item>
               <stage>(SEJA JE BILA PREKINJENA 2. JULIJA 1997 OB 18.13 URI.)</stage>
               <idno>SDZ2-Redna-06-1997-07-02.stage24</idno>
            </item>
            <item>
               <stage>(SEJA JE BILA PREKINJENA 2. MARCA 2000 OB 18.02 URI.)</stage>
               <idno>SDZ2-Redna-19-2000-03-02.stage19</idno>
            </item>
            <item>
               <stage>(SEJA JE BILA PREKINJENA 2. OKTOBRA 1997 OB 16.47 URI.)</stage>
               <idno>SDZ2-Izredna-15-1997-10-02.stage43</idno>
            </item>
            <item>
               <stage>(SEJA JE BILA PREKINJENA 2. OKTOBRA 1998 OB 14.02 URI.)</stage>
               <idno>SDZ2-Izredna-25-1998-10-02.stage34</idno>
            </item>
            <item>
               <stage>(SEJA JE BILA PREKINJENA 2.DECEMBRA 1996 OB 23.47 URI.)</stage>
               <idno>SDZ2-Redna-01-1996-12-02.stage43</idno>
            </item>
            <item>
               <stage>(SEJA JE BILA PREKINJENA 20. FEBRUARJA 1998 OB 14.03 URI.)</stage>
               <idno>SDZ2-Redna-08-1998-02-20.stage10</idno>
            </item>
            <item>
               <stage>(SEJA JE BILA PREKINJENA 20. JANUARJA 1998 OB 18.00 URI.)</stage>
               <idno>SDZ2-Izredna-19-1998-01-20.stage117</idno>
            </item>
            <item>
               <stage>(SEJA JE BILA PREKINJENA 20. JANUARJA 2000 OB 18.58 URI.)</stage>
               <idno>SDZ2-Izredna-43-2000-01-20.stage506</idno>
            </item>
            <item>
               <stage>(SEJA JE BILA PREKINJENA 20. JULIJA 2000 OB 18.15 URI.)</stage>
               <idno>SDZ2-Izredna-52-2000-07-20.stage201</idno>
            </item>
            <item>
               <stage>(SEJA JE BILA PREKINJENA 20. MAJA 1997 OB 17.40 URI.)</stage>
               <idno>SDZ2-Redna-04-1997-05-20.stage248</idno>
            </item>
            <item>
               <stage>(SEJA JE BILA PREKINJENA 20. MAJA 1999 OB 17.55 URI.)</stage>
               <idno>SDZ2-Redna-14-1999-05-20.stage430</idno>
            </item>
            <item>
               <stage>(SEJA JE BILA PREKINJENA 20. NOVEMBRA 1997 OB 16.07 URI.)</stage>
               <idno>SDZ2-Redna-07-1997-11-20.stage34</idno>
            </item>
            <item>
               <stage>(SEJA JE BILA PREKINJENA 20. OKTOBRA 1999 OB 17.57 URI.)</stage>
               <idno>SDZ2-Redna-16-1999-10-20.stage268</idno>
            </item>
            <item>
               <stage>(SEJA JE BILA PREKINJENA 20.6.2000 OB 18.06 URI.)</stage>
               <idno>SDZ2-Izredna-51-2000-06-20.stage307</idno>
            </item>
            <item>
               <stage>(SEJA JE BILA PREKINJENA 21. APRILA 1998 OB 17.57 URI.)</stage>
               <idno>SDZ2-Izredna-21-1998-04-21.stage93</idno>
            </item>
            <item>
               <stage>(SEJA JE BILA PREKINJENA 21. DECEMBRA 1999 OB 17.32 URI.)</stage>
               <idno>SDZ2-Izredna-42-1999-12-22.stage213</idno>
            </item>
            <item>
               <stage>(SEJA JE BILA PREKINJENA 21. DECEMBRA 1999 OB 18.06 URI.)</stage>
               <idno>SDZ2-Izredna-42-1999-12-21.stage352</idno>
            </item>
            <item>
               <stage>(SEJA JE BILA PREKINJENA 21. JANUARJA 1998 OB 17.50 URI.)</stage>
               <idno>SDZ2-Izredna-19-1998-01-21.stage21</idno>
            </item>
            <item>
               <stage>(SEJA JE BILA PREKINJENA 21. JANUARJA 1999 OB 17.24 URI.)</stage>
               <idno>SDZ2-Izredna-31-1999-01-21.stage16</idno>
            </item>
            <item>
               <stage>(SEJA JE BILA PREKINJENA 21. JULIJA 1998 OB 18.00 URI.)</stage>
               <idno>SDZ2-Izredna-23-1998-07-21.stage75</idno>
            </item>
            <item>
               <stage>(SEJA JE BILA PREKINJENA 21. JULIJA 1999 OB 17.54 URI.)</stage>
               <idno>SDZ2-Izredna-38-1999-07-22.stage791</idno>
            </item>
            <item>
               <stage>(SEJA JE BILA PREKINJENA 21. JUNIJA 2000 OB 17.04 URI.)</stage>
               <idno>SDZ2-Izredna-51-2000-06-21.stage118</idno>
            </item>
            <item>
               <stage>(SEJA JE BILA PREKINJENA 21. MAJA 1998 OB 1.05 URI.)</stage>
               <idno>SDZ2-Redna-09-1998-05-20.stage70</idno>
            </item>
            <item>
               <stage>(SEJA JE BILA PREKINJENA 21. MAJA 1998 OB 19.36)</stage>
               <idno>SDZ2-Redna-09-1998-05-21.stage47</idno>
            </item>
            <item>
               <stage>(SEJA JE BILA PREKINJENA 21. MAJA 1999 OB 12.59 URI.)</stage>
               <idno>SDZ2-Redna-14-1999-05-21.stage185</idno>
            </item>
            <item>
               <stage>(SEJA JE BILA PREKINJENA 21. NOVEMBRA 1997 OB 12.00 URI.)</stage>
               <idno>SDZ2-Redna-07-1997-11-21.stage15</idno>
            </item>
            <item>
               <stage>(SEJA JE BILA PREKINJENA 21. OKTOBRA 1999 OB 17.59 URI.)</stage>
               <idno>SDZ2-Redna-16-1999-10-21.stage261</idno>
            </item>
            <item>
               <stage>(SEJA JE BILA PREKINJENA 21. SEPTEMBRA OB 18.19 URI.)</stage>
               <idno>SDZ2-Redna-16-1999-09-21.stage136</idno>
            </item>
            <item>
               <stage>(SEJA JE BILA PREKINJENA 22. APRILA 1997 OB 17.47 URI.)</stage>
               <idno>SDZ2-Redna-04-1997-04-22.stage225</idno>
            </item>
            <item>
               <stage>(SEJA JE BILA PREKINJENA 22. APRILA 1998 OB 18.06 URI.)</stage>
               <idno>SDZ2-Redna-08-1998-04-22.stage781</idno>
            </item>
            <item>
               <stage>(SEJA JE BILA PREKINJENA 22. APRILA 1999 OB 18.01 URI.)</stage>
               <idno>SDZ2-Redna-13-1999-04-22.stage266</idno>
            </item>
            <item>
               <stage>(SEJA JE BILA PREKINJENA 22. DECEMBRA 1998 OB 17.54 URI.)</stage>
               <idno>SDZ2-Izredna-30-1998-12-22.stage370</idno>
            </item>
            <item>
               <stage>(SEJA JE BILA PREKINJENA 22. FEBRUAR 2000 OB 18.35 URI.)</stage>
               <idno>SDZ2-Redna-19-2000-02-22.stage70</idno>
            </item>
            <item>
               <stage>(SEJA JE BILA PREKINJENA 22. JANUARJA 1998 OB 17.00 URI.)</stage>
               <idno>SDZ2-Izredna-19-1998-01-22.stage44</idno>
            </item>
            <item>
               <stage>(SEJA JE BILA PREKINJENA 22. JANUARJA 1999 OB 13.34 URI.)</stage>
               <idno>SDZ2-Redna-10-1999-01-22.stage98</idno>
            </item>
            <item>
               <stage>(SEJA JE BILA PREKINJENA 22. JULIJA 1997 OB 16.43 URI.)</stage>
               <idno>SDZ2-Redna-06-1997-07-22.stage127</idno>
            </item>
            <item>
               <stage>(SEJA JE BILA PREKINJENA 22. JUNIJA 1999 OB 19.00 URI.)</stage>
               <idno>SDZ2-Redna-15-1999-06-22.stage191</idno>
            </item>
            <item>
               <stage>(SEJA JE BILA PREKINJENA 22. JUNIJA 2000 OB 18.00 URI.)</stage>
               <idno>SDZ2-Izredna-51-2000-06-22.stage372</idno>
            </item>
            <item>
               <stage>(SEJA JE BILA PREKINJENA 22. MAJA 1997 OB 12.14 URI.)</stage>
               <idno>SDZ2-Redna-05-1997-05-22.stage68</idno>
            </item>
            <item>
               <stage>(SEJA JE BILA PREKINJENA 22. MAJA 1997 OB 21.55 URI.)</stage>
               <idno>SDZ2-Izredna-04-1997-05-22.stage43</idno>
            </item>
            <item>
               <stage>(SEJA JE BILA PREKINJENA 22. MAJA 1998 OB 13.00 URI.)</stage>
               <idno>SDZ2-Redna-09-1998-05-22.stage150</idno>
            </item>
            <item>
               <stage>(SEJA JE BILA PREKINJENA 22. MARCA 2000 OB 18.06 URI.)</stage>
               <idno>SDZ2-Redna-20-2000-03-22.stage475</idno>
            </item>
            <item>
               <stage>(SEJA JE BILA PREKINJENA 22. OKTOBRA 1999 OB 13.53 URI.)</stage>
               <idno>SDZ2-Redna-16-1999-10-22.stage121</idno>
            </item>
            <item>
               <stage>(SEJA JE BILA PREKINJENA 22. SEPTEMBRA 1998 OB 18.04 URI.)</stage>
               <idno>SDZ2-Izredna-24-1998-09-22.stage32</idno>
            </item>
            <item>
               <stage>(SEJA JE BILA PREKINJENA 22.SEPTEMBRA 1999 OB 17.59 URI.)</stage>
               <idno>SDZ2-Redna-16-1999-09-22.stage520</idno>
            </item>
            <item>
               <stage>(SEJA JE BILA PREKINJENA 23. APRILA 1997 OB 17.54 URI.)</stage>
               <idno>SDZ2-Redna-04-1997-04-23.stage196</idno>
            </item>
            <item>
               <stage>(SEJA JE BILA PREKINJENA 23. APRILA 1998 OB 19.16 URI.)</stage>
               <idno>SDZ2-Redna-08-1998-04-23.stage181</idno>
            </item>
            <item>
               <stage>(SEJA JE BILA PREKINJENA 23. DECEMBRA 1998 OB 15.59 URI.)</stage>
               <idno>SDZ2-Redna-10-1998-12-23.stage373</idno>
            </item>
            <item>
               <stage>(SEJA JE BILA PREKINJENA 23. FEBRUARJA 1999 OB 16.44 URI.)</stage>
               <idno>SDZ2-Redna-11-1999-02-23.stage36</idno>
            </item>
            <item>
               <stage>(SEJA JE BILA PREKINJENA 23. FEBRUARJA 2000 OB 17.57 URI.)</stage>
               <idno>SDZ2-Redna-19-2000-02-23.stage360</idno>
            </item>
            <item>
               <stage>(SEJA JE BILA PREKINJENA 23. JULIJA 1997 OB 17.35 URI.)</stage>
               <idno>SDZ2-Redna-06-1997-07-23.stage73</idno>
            </item>
            <item>
               <stage>(SEJA JE BILA PREKINJENA 23. JULIJA 1999 OB 14.15 URI.)</stage>
               <idno>SDZ2-Izredna-38-1999-07-23.stage56</idno>
            </item>
            <item>
               <stage>(SEJA JE BILA PREKINJENA 23. JUNIJA 1998 OB 18.03 URI.)</stage>
               <idno>SDZ2-Redna-09-1998-06-23.stage230</idno>
            </item>
            <item>
               <stage>(SEJA JE BILA PREKINJENA 23. JUNIJA 2000 OB 13.57 URI.)</stage>
               <idno>SDZ2-Izredna-51-2000-06-23.stage221</idno>
            </item>
            <item>
               <stage>(SEJA JE BILA PREKINJENA 23. MARCA 1999 OB 20.01 URI.)</stage>
               <idno>SDZ2-Redna-12-1999-03-23.stage882</idno>
            </item>
            <item>
               <stage>(SEJA JE BILA PREKINJENA 23. MARCA 2000 OB 17.58 URI.)</stage>
               <idno>SDZ2-Redna-20-2000-03-23.stage436</idno>
            </item>
            <item>
               <stage>(SEJA JE BILA PREKINJENA 23. SEPTEMBRA 1998 OB 17.59 URI.)</stage>
               <idno>SDZ2-Izredna-24-1998-09-23.stage28</idno>
            </item>
            <item>
               <stage>(SEJA JE BILA PREKINJENA 23. SEPTEMBRA 1999 OB 17.58 URI.)</stage>
               <idno>SDZ2-Redna-16-1999-09-23.stage179</idno>
            </item>
            <item>
               <stage>(SEJA JE BILA PREKINJENA 23.12.1999 OB 13.58 URI.)</stage>
               <idno>SDZ2-Redna-17-1999-12-23.stage12</idno>
            </item>
            <item>
               <stage>(SEJA JE BILA PREKINJENA 23.6.1999 OB 18.55 URI.)</stage>
               <idno>SDZ2-Redna-15-1999-06-23.stage718</idno>
            </item>
            <item>
               <stage>(SEJA JE BILA PREKINJENA 24. APRILA 1997 OB 17.29 URI.)</stage>
               <idno>SDZ2-Redna-04-1997-04-24.stage144</idno>
            </item>
            <item>
               <stage>(SEJA JE BILA PREKINJENA 24. JULIJA 1997 OB 17.56 URI.)</stage>
               <idno>SDZ2-Redna-06-1997-07-24.stage68</idno>
            </item>
            <item>
               <stage>(SEJA JE BILA PREKINJENA 24. JULIJA 1998 OB 15.27 URI.)</stage>
               <idno>SDZ2-Redna-10-1998-07-24.stage117</idno>
            </item>
            <item>
               <stage>(SEJA JE BILA PREKINJENA 24. JUNIJA 1997 OB 21.35 URI.)</stage>
               <idno>SDZ2-Izredna-07-1997-06-24.stage114</idno>
            </item>
            <item>
               <stage>(SEJA JE BILA PREKINJENA 24. JUNIJA 1998 OB 16.30 URI.)</stage>
               <idno>SDZ2-Redna-09-1998-06-24.stage305</idno>
            </item>
            <item>
               <stage>(SEJA JE BILA PREKINJENA 24. MAJA 2000 OB 18.05 URI.)</stage>
               <idno>SDZ2-Redna-21-2000-05-24.stage950</idno>
            </item>
            <item>
               <stage>(SEJA JE BILA PREKINJENA 24. MARCA 2000 OB 14.00 URI.)</stage>
               <idno>SDZ2-Redna-20-2000-03-24.stage418</idno>
            </item>
            <item>
               <stage>(SEJA JE BILA PREKINJENA 24. NOVEMBRA 1999 OB 18.00 URI.)</stage>
               <idno>SDZ2-Redna-17-1999-11-24.stage351</idno>
            </item>
            <item>
               <stage>(SEJA JE BILA PREKINJENA 24. SEPTEMBRA 1998 OB 18.01 URI.)</stage>
               <idno>SDZ2-Redna-10-1998-09-24.stage326</idno>
            </item>
            <item>
               <stage>(SEJA JE BILA PREKINJENA 24. SEPTEMBRA 1999 OB 14.03 URI.)</stage>
               <idno>SDZ2-Redna-16-1999-09-24.stage404</idno>
            </item>
            <item>
               <stage>(SEJA JE BILA PREKINJENA 25. FEBRUARJA 2000 OB 13.57 URI.)</stage>
               <idno>SDZ2-Redna-19-2000-02-25.stage266</idno>
            </item>
            <item>
               <stage>(SEJA JE BILA PREKINJENA 25. JULIJA 1997 OB 13.39 URI.)</stage>
               <idno>SDZ2-Redna-06-1997-07-25.stage173</idno>
            </item>
            <item>
               <stage>(SEJA JE BILA PREKINJENA 25. JULIJA OB 21.03 URI.)</stage>
               <idno>SDZ2-Izredna-53-2000-07-25.stage102</idno>
            </item>
            <item>
               <stage>(SEJA JE BILA PREKINJENA 25. MAJA 1999 OB 18.01 URI.)</stage>
               <idno>SDZ2-Redna-14-1999-05-25.stage45</idno>
            </item>
            <item>
               <stage>(SEJA JE BILA PREKINJENA 25. MARCA 1997 OB 17.46 URI.)</stage>
               <idno>SDZ2-Redna-03-1997-03-25.stage388</idno>
            </item>
            <item>
               <stage>(SEJA JE BILA PREKINJENA 25. MARCA 1999 OB 16.49 URI.)</stage>
               <idno>SDZ2-Redna-12-1999-03-25.stage62</idno>
            </item>
            <item>
               <stage>(SEJA JE BILA PREKINJENA 25. NOVEMBRA 1997 OB 17.33 URI.)</stage>
               <idno>SDZ2-Izredna-16-1997-11-25.stage221</idno>
            </item>
            <item>
               <stage>(SEJA JE BILA PREKINJENA 25. NOVEMBRA 1999 OB 17.52 URI.)</stage>
               <idno>SDZ2-Redna-17-1999-11-25.stage863</idno>
            </item>
            <item>
               <stage>(SEJA JE BILA PREKINJENA 25. SEPTEMBRA 1997 OB 19.53 URI.)</stage>
               <idno>SDZ2-Izredna-14-1997-09-25.stage39</idno>
            </item>
            <item>
               <stage>(SEJA JE BILA PREKINJENA 25.1.2000 OB 18.49 URI.)</stage>
               <idno>SDZ2-Redna-18-2000-01-25.stage92</idno>
            </item>
            <item>
               <stage>(SEJA JE BILA PREKINJENA 26. FEBRUARJA 1998 OB 18. URI.)</stage>
               <idno>SDZ2-Redna-08-1998-02-26.stage313</idno>
            </item>
            <item>
               <stage>(SEJA JE BILA PREKINJENA 26. JANUARJA 1999 OB 18.04 URI.)</stage>
               <idno>SDZ2-Redna-10-1999-01-26.stage79</idno>
            </item>
            <item>
               <stage>(SEJA JE BILA PREKINJENA 26. JANUARJA 2000 OB 17.26 URI.)</stage>
               <idno>SDZ2-Redna-18-2000-01-26.stage119</idno>
            </item>
            <item>
               <stage>(SEJA JE BILA PREKINJENA 26. JULIJA 2000 OB 18.53 URI.)</stage>
               <idno>SDZ2-Izredna-53-2000-07-26.stage520</idno>
            </item>
            <item>
               <stage>(SEJA JE BILA PREKINJENA 26. JUNIJA 1997 OB 17.48 URI.)</stage>
               <idno>SDZ2-Redna-06-1997-06-26.stage224</idno>
            </item>
            <item>
               <stage>(SEJA JE BILA PREKINJENA 26. MAJA 1998 OB 18.05 URI.)</stage>
               <idno>SDZ2-Redna-09-1998-05-26.stage79</idno>
            </item>
            <item>
               <stage>(SEJA JE BILA PREKINJENA 26. MAJA 1999 OB 17.52 URI.)</stage>
               <idno>SDZ2-Redna-14-1999-05-26.stage328</idno>
            </item>
            <item>
               <stage>(SEJA JE BILA PREKINJENA 26. MARCA 1997 OB 16.50 URI.)</stage>
               <idno>SDZ2-Redna-03-1997-03-26.stage412</idno>
            </item>
            <item>
               <stage>(SEJA JE BILA PREKINJENA 26. MARCA 1998 OB 18.02 URI.)</stage>
               <idno>SDZ2-Redna-08-1998-03-26.stage40</idno>
            </item>
            <item>
               <stage>(SEJA JE BILA PREKINJENA 26. MARCA 1999 OB 13.40 URI.)</stage>
               <idno>SDZ2-Redna-12-1999-03-26.stage57</idno>
            </item>
            <item>
               <stage>(SEJA JE BILA PREKINJENA 26. NOVEMBRA 1997 OB 18.00 URI.)</stage>
               <idno>SDZ2-Izredna-16-1997-11-26.stage260</idno>
            </item>
            <item>
               <stage>(SEJA JE BILA PREKINJENA 26. NOVEMBRA 1998 OB 18.11 URI.)</stage>
               <idno>SDZ2-Izredna-29-1998-11-26.stage26</idno>
            </item>
            <item>
               <stage>(SEJA JE BILA PREKINJENA 27. JANUARJA 1998 OB 18.01 URI.)</stage>
               <idno>SDZ2-Izredna-03-1998-01-27.stage107 SDZ2-Izredna-19-1998-01-27.stage107</idno>
            </item>
            <item>
               <stage>(SEJA JE BILA PREKINJENA 27. JANUARJA 2000 OB 18.03 URI.)</stage>
               <idno>SDZ2-Redna-18-2000-01-27.stage98</idno>
            </item>
            <item>
               <stage>(SEJA JE BILA PREKINJENA 27. JULIJA 1998 OB 17.52 URI.)</stage>
               <idno>SDZ2-Redna-10-1998-07-27.stage155</idno>
            </item>
            <item>
               <stage>(SEJA JE BILA PREKINJENA 27. JULIJA 1999 OB 18.05 URI.)</stage>
               <idno>SDZ2-Izredna-38-1999-07-27.stage19</idno>
            </item>
            <item>
               <stage>(SEJA JE BILA PREKINJENA 27. JULIJA 2000 OB 17.59 URI.)</stage>
               <idno>SDZ2-Izredna-53-2000-07-27.stage305</idno>
            </item>
            <item>
               <stage>(SEJA JE BILA PREKINJENA 27. JUNIJA 1997 OB 14.11 URI.)</stage>
               <idno>SDZ2-Redna-06-1997-06-27.stage37</idno>
            </item>
            <item>
               <stage>(SEJA JE BILA PREKINJENA 27. JUNIJA 2000 OB 17.40 URI.)</stage>
               <idno>SDZ2-Izredna-51-2000-06-27.stage33</idno>
            </item>
            <item>
               <stage>(SEJA JE BILA PREKINJENA 27. MAJA 1997 OB 17.38 URI.)</stage>
               <idno>SDZ2-Redna-05-1997-05-27.stage441</idno>
            </item>
            <item>
               <stage>(SEJA JE BILA PREKINJENA 27. MAJA 1998 OB 17.20 URI.)</stage>
               <idno>SDZ2-Redna-09-1998-05-27.stage104</idno>
            </item>
            <item>
               <stage>(SEJA JE BILA PREKINJENA 27. MAJA 1999 PB 18.05 URI.)</stage>
               <idno>SDZ2-Redna-14-1999-05-27.stage146</idno>
            </item>
            <item>
               <stage>(SEJA JE BILA PREKINJENA 27. MARCA 1997 OB 11.26 URI.)</stage>
               <idno>SDZ2-Redna-03-1997-03-27.stage203</idno>
            </item>
            <item>
               <stage>(SEJA JE BILA PREKINJENA 27. NOVEMBRA 1997 OB 17.55 URI.)</stage>
               <idno>SDZ2-Izredna-16-1997-11-27.stage333</idno>
            </item>
            <item>
               <stage>(SEJA JE BILA PREKINJENA 27. NOVEMBRA 1998 OB 13.52 URI.)</stage>
               <idno>SDZ2-Izredna-29-1998-11-27.stage36</idno>
            </item>
            <item>
               <stage>(SEJA JE BILA PREKINJENA 27. OKTOBRA 1999 OB 18.03 URI.)</stage>
               <idno>SDZ2-Redna-16-1999-10-27.stage299</idno>
            </item>
            <item>
               <stage>(SEJA JE BILA PREKINJENA 28 OKTOBRA 1997 OB 17.52 URI.)</stage>
               <idno>SDZ2-Redna-07-1997-10-28.stage324</idno>
            </item>
            <item>
               <stage>(SEJA JE BILA PREKINJENA 28. APRILA 1999 OB 19.02 URI.)</stage>
               <idno>SDZ2-Redna-13-1999-04-28.stage202</idno>
            </item>
            <item>
               <stage>(SEJA JE BILA PREKINJENA 28. JANUARJA 1999 OB 18.02 URI.)</stage>
               <idno>SDZ2-Izredna-32-1999-01-28.stage69</idno>
            </item>
            <item>
               <stage>(SEJA JE BILA PREKINJENA 28. JULIJA 1998 OB 19.03 URI.)</stage>
               <idno>SDZ2-Redna-10-1998-07-28.stage124</idno>
            </item>
            <item>
               <stage>(SEJA JE BILA PREKINJENA 28. MAJA 1997 OB 18.11 URI.)</stage>
               <idno>SDZ2-Redna-05-1997-05-28.stage883</idno>
            </item>
            <item>
               <stage>(SEJA JE BILA PREKINJENA 28. MAJA 1998 OB 17.58 URI.)</stage>
               <idno>SDZ2-Redna-09-1998-05-28.stage483</idno>
            </item>
            <item>
               <stage>(SEJA JE BILA PREKINJENA 28. MARCA 2000 OB 17.23 URI.)</stage>
               <idno>SDZ2-Redna-20-2000-03-28.stage14</idno>
            </item>
            <item>
               <stage>(SEJA JE BILA PREKINJENA 28. NOVEMBRA 1996 OB 16.32 URI.)</stage>
               <idno>SDZ2-Redna-01-1996-11-28.stage42</idno>
            </item>
            <item>
               <stage>(SEJA JE BILA PREKINJENA 28. NOVEMBRA 1997 OB 14.06 URI.)</stage>
               <idno>SDZ2-Izredna-16-1997-11-28.stage152</idno>
            </item>
            <item>
               <stage>(SEJA JE BILA PREKINJENA 28. OKTOBRA 1998 OB 17.48 URI.)</stage>
               <idno>SDZ2-Izredna-28-1998-10-28.stage46</idno>
            </item>
            <item>
               <stage>(SEJA JE BILA PREKINJENA 28.10.1999 OB 17.48 URI.)</stage>
               <idno>SDZ2-Redna-16-1999-10-28.stage381</idno>
            </item>
            <item>
               <stage>(SEJA JE BILA PREKINJENA 28.JANUARJA 1998 OB 18.01 URI.)</stage>
               <idno>SDZ2-Izredna-19-1998-01-28.stage264</idno>
            </item>
            <item>
               <stage>(SEJA JE BILA PREKINJENA 28.SEPTEMBRA 1999 OB 18.19 URI.)</stage>
               <idno>SDZ2-Redna-16-1999-09-28.stage34</idno>
            </item>
            <item>
               <stage>(SEJA JE BILA PREKINJENA 29. APRILA 1997 OB 18.21 URI.)</stage>
               <idno>SDZ2-Redna-04-1997-04-29.stage47</idno>
            </item>
            <item>
               <stage>(SEJA JE BILA PREKINJENA 29. JANUARJA 1998 OB 17.19 URI.)</stage>
               <idno>SDZ2-Izredna-19-1998-01-29.stage341</idno>
            </item>
            <item>
               <stage>(SEJA JE BILA PREKINJENA 29. JULIJA 1997 OB 18.10 URI.)</stage>
               <idno>SDZ2-Izredna-12-1997-07-29.stage149</idno>
            </item>
            <item>
               <stage>(SEJA JE BILA PREKINJENA 29. JULIJA 1998 OB 17.51 URI.)</stage>
               <idno>SDZ2-Redna-10-1998-07-29.stage435</idno>
            </item>
            <item>
               <stage>(SEJA JE BILA PREKINJENA 29. MAJA 1997 OB 18.10 URI.)</stage>
               <idno>SDZ2-Redna-05-1997-05-29.stage166</idno>
            </item>
            <item>
               <stage>(SEJA JE BILA PREKINJENA 29. OKTOBRA 1997 OB 17.42 URI.)</stage>
               <idno>SDZ2-Redna-07-1997-10-29.stage182</idno>
            </item>
            <item>
               <stage>(SEJA JE BILA PREKINJENA 29. OKTOBRA 1999 OB 13.57 URI.)</stage>
               <idno>SDZ2-Redna-16-1999-10-29.stage124</idno>
            </item>
            <item>
               <stage>(SEJA JE BILA PREKINJENA 29. SEPTEMBRA 1998 OB 16.32 URI.)</stage>
               <idno>SDZ2-Redna-10-1998-09-29.stage73</idno>
            </item>
            <item>
               <stage>(SEJA JE BILA PREKINJENA 29. SEPTEMBRA 1999 OB 18.00 URI.)</stage>
               <idno>SDZ2-Redna-16-1999-09-29.stage832</idno>
            </item>
            <item>
               <stage>(SEJA JE BILA PREKINJENA 29.2.2000 OB 17.41 URI.)</stage>
               <idno>SDZ2-Redna-19-2000-02-29.stage290</idno>
            </item>
            <item>
               <stage>(SEJA JE BILA PREKINJENA 29.3.2000 OB 18.00 URI.)</stage>
               <idno>SDZ2-Redna-20-2000-03-29.stage284</idno>
            </item>
            <item>
               <stage>(SEJA JE BILA PREKINJENA 29.7.1999 OB 18.08 URI.)</stage>
               <idno>SDZ2-Izredna-38-1999-07-29.stage371</idno>
            </item>
            <item>
               <stage>(SEJA JE BILA PREKINJENA 3. APRILA 1998 OB 14.08 URI.)</stage>
               <idno>SDZ2-Redna-08-1998-04-03.stage136</idno>
            </item>
            <item>
               <stage>(SEJA JE BILA PREKINJENA 3. DECEMBER 1999 OB 14.21 URI.)</stage>
               <idno>SDZ2-Redna-17-1999-12-03.stage99</idno>
            </item>
            <item>
               <stage>(SEJA JE BILA PREKINJENA 3. DECEMBRA 1997 OB 20.03 URI.)</stage>
               <idno>SDZ2-Izredna-16-1997-12-03.stage245</idno>
            </item>
            <item>
               <stage>(SEJA JE BILA PREKINJENA 3. FEBRUARJA 1998 OB 18.06 URI.)</stage>
               <idno>SDZ2-Izredna-19-1998-02-03.stage215</idno>
            </item>
            <item>
               <stage>(SEJA JE BILA PREKINJENA 3. JULIJA 1997 OB 17.50 URI.)</stage>
               <idno>SDZ2-Redna-06-1997-07-03.stage74</idno>
            </item>
            <item>
               <stage>(SEJA JE BILA PREKINJENA 3. JUNIJA 1997 OB 17.00 URI.)</stage>
               <idno>SDZ2-Redna-05-1997-06-03.stage120</idno>
            </item>
            <item>
               <stage>(SEJA JE BILA PREKINJENA 3. MARCA 1998 OB 18.05 URI.)</stage>
               <idno>SDZ2-Redna-08-1998-03-03.stage212</idno>
            </item>
            <item>
               <stage>(SEJA JE BILA PREKINJENA 3. MARCA 2000 OB 14.02 URI.)</stage>
               <idno>SDZ2-Redna-19-2000-03-03.stage31</idno>
            </item>
            <item>
               <stage>(SEJA JE BILA PREKINJENA 30. APRILA 1997 OB 12.39 URI.)</stage>
               <idno>SDZ2-Redna-04-1997-04-30.stage29</idno>
            </item>
            <item>
               <stage>(SEJA JE BILA PREKINJENA 30. AVGUSTA 2000 OB 17.43 URI.)</stage>
               <idno>SDZ2-Izredna-54-2000-08-30.stage322</idno>
            </item>
            <item>
               <stage>(SEJA JE BILA PREKINJENA 30. JANUARJA 1998 OB 13.24 URI.)</stage>
               <idno>SDZ2-Izredna-19-1998-01-30.stage23</idno>
            </item>
            <item>
               <stage>(SEJA JE BILA PREKINJENA 30. JULIJA 1997 OB 17.18 URI.)</stage>
               <idno>SDZ2-Izredna-12-1997-07-30.stage56</idno>
            </item>
            <item>
               <stage>(SEJA JE BILA PREKINJENA 30. JULIJA 1998 OB 16.25 URI.)</stage>
               <idno>SDZ2-Redna-10-1998-07-30.stage327</idno>
            </item>
            <item>
               <stage>(SEJA JE BILA PREKINJENA 30. MAJA 1997 OB 13.17 URI.)</stage>
               <idno>SDZ2-Redna-05-1997-05-30.stage48</idno>
            </item>
            <item>
               <stage>(SEJA JE BILA PREKINJENA 30. OKTOBRA 1997 OB 13.55 URI.)</stage>
               <idno>SDZ2-Redna-07-1997-10-30.stage241</idno>
            </item>
            <item>
               <stage>(SEJA JE BILA PREKINJENA 30. SEPTEMBRA 1997 OB 17.48 URI.)</stage>
               <idno>SDZ2-Izredna-15-1997-09-30.stage50</idno>
            </item>
            <item>
               <stage>(SEJA JE BILA PREKINJENA 30.11.1999 OB 17.06 URI.)</stage>
               <idno>SDZ2-Redna-17-1999-11-30.stage220</idno>
            </item>
            <item>
               <stage>(SEJA JE BILA PREKINJENA 30.6.2000 OB 14.00 URI.)</stage>
               <idno>SDZ2-Izredna-51-2000-06-30.stage76</idno>
            </item>
            <item>
               <stage>(SEJA JE BILA PREKINJENA 31. MAJA 2000 OB 16.28 URI.)</stage>
               <idno>SDZ2-Izredna-49-2000-05-31.stage547</idno>
            </item>
            <item>
               <stage>(SEJA JE BILA PREKINJENA 31.8.2000 OB 17.28 URI.)</stage>
               <idno>SDZ2-Izredna-54-2000-08-31.stage93</idno>
            </item>
            <item>
               <stage>(SEJA JE BILA PREKINJENA 4. DECEMBRA 1997 OB 18.08 URI.)</stage>
               <idno>SDZ2-Izredna-16-1997-12-04.stage26</idno>
            </item>
            <item>
               <stage>(SEJA JE BILA PREKINJENA 4. DECEMBRA 1998 OB 12.52 URI.)</stage>
               <idno>SDZ2-Izredna-29-1998-12-04.stage16</idno>
            </item>
            <item>
               <stage>(SEJA JE BILA PREKINJENA 4. JULIJA 1997 OB 13.05 URI.)</stage>
               <idno>SDZ2-Redna-06-1997-07-04.stage12</idno>
            </item>
            <item>
               <stage>(SEJA JE BILA PREKINJENA 4. MARCA 1998 OB 17.55 URI.)</stage>
               <idno>SDZ2-Redna-08-1998-03-04.stage438</idno>
            </item>
            <item>
               <stage>(SEJA JE BILA PREKINJENA 5. DECEMBRA 1997 OB 14.05 URI.)</stage>
               <idno>SDZ2-Izredna-16-1997-12-05.stage21</idno>
            </item>
            <item>
               <stage>(SEJA JE BILA PREKINJENA 5. JUNIJA 1997 OB 17.57 URI.)</stage>
               <idno>SDZ2-Redna-05-1997-06-05.stage154</idno>
            </item>
            <item>
               <stage>(SEJA JE BILA PREKINJENA 5. MARCA 1998 OB 17.22 URI.)</stage>
               <idno>SDZ2-Redna-08-1998-03-05.stage211</idno>
            </item>
            <item>
               <stage>(SEJA JE BILA PREKINJENA 5. SEPTEMBRA 2000 OB 16.24 URI.)</stage>
               <idno>SDZ2-Izredna-54-2000-09-05.stage98</idno>
            </item>
            <item>
               <stage>(SEJA JE BILA PREKINJENA 6. JUNIJA 1997 OB 13.52 URI.)</stage>
               <idno>SDZ2-Redna-05-1997-06-06.stage68</idno>
            </item>
            <item>
               <stage>(SEJA JE BILA PREKINJENA 6. MAJA 1997 OB 17.31 URI.)</stage>
               <idno>SDZ2-Redna-04-1997-05-06.stage158</idno>
            </item>
            <item>
               <stage>(SEJA JE BILA PREKINJENA 7. APRILA 1998 OB 17.59 URI.)</stage>
               <idno>SDZ2-Izredna-21-1998-04-07.stage58</idno>
            </item>
            <item>
               <stage>(SEJA JE BILA PREKINJENA 7. APRILA 2000 OB 17.43 URI.)</stage>
               <idno>SDZ2-Izredna-44-2000-04-07.stage33</idno>
            </item>
            <item>
               <stage>(SEJA JE BILA PREKINJENA 7. JULIJA 1999 OB 17.59 URI.)</stage>
               <idno>SDZ2-Izredna-37-1999-07-07.stage270</idno>
            </item>
            <item>
               <stage>(SEJA JE BILA PREKINJENA 7. MAJA 1997 OB 17.36 URI.)</stage>
               <idno>SDZ2-Redna-04-1997-05-07.stage370</idno>
            </item>
            <item>
               <stage>(SEJA JE BILA PREKINJENA 8. APRILA 1998 OB 19.42 URI.)</stage>
               <idno>SDZ2-Izredna-21-1998-04-08.stage414</idno>
            </item>
            <item>
               <stage>(SEJA JE BILA PREKINJENA 8. APRILA 2000 OB 11.06 URI.)</stage>
               <idno>SDZ2-Izredna-44-2000-04-08.stage19</idno>
            </item>
            <item>
               <stage>(SEJA JE BILA PREKINJENA 8. DECEMBRA 1998 OB 18.03 URI.)</stage>
               <idno>SDZ2-Izredna-29-1998-12-08.stage18</idno>
            </item>
            <item>
               <stage>(SEJA JE BILA PREKINJENA 8. JANUARJA 1997 OB 20.16 URI.)</stage>
               <idno>SDZ2-Izredna-01-1997-01-08.stage48</idno>
            </item>
            <item>
               <stage>(SEJA JE BILA PREKINJENA 8. JULIJA 1998 OB 16.47 URI.)</stage>
               <idno>SDZ2-Izredna-23-1998-07-08.stage67</idno>
            </item>
            <item>
               <stage>(SEJA JE BILA PREKINJENA 8. MAJA 1997 OB 17.26 URI.)</stage>
               <idno>SDZ2-Redna-04-1997-05-08.stage16</idno>
            </item>
            <item>
               <stage>(SEJA JE BILA PREKINJENA 8. OKTOBRA 1997 OB 16.58 URI.)</stage>
               <idno>SDZ2-Redna-06-1997-10-08.stage90</idno>
            </item>
            <item>
               <stage>(SEJA JE BILA PREKINJENA 9. APRILA 1998 OB 21.07 URI.)</stage>
               <idno>SDZ2-Izredna-21-1998-04-09.stage730</idno>
            </item>
            <item>
               <stage>(SEJA JE BILA PREKINJENA 9. DECEMBRA 1997 OB 19.57. URI.)</stage>
               <idno>SDZ2-Izredna-16-1997-12-09.stage29</idno>
            </item>
            <item>
               <stage>(SEJA JE BILA PREKINJENA 9. FEBRUARJA 2000 OB 18.16 URI.)</stage>
               <idno>SDZ2-Redna-18-2000-02-09.stage439</idno>
            </item>
            <item>
               <stage>(SEJA JE BILA PREKINJENA 9. JANUARJA 1997 OB 18.58 URI.)</stage>
               <idno>SDZ2-Izredna-01-1997-01-09.stage35</idno>
            </item>
            <item>
               <stage>(SEJA JE BILA PREKINJENA 9. JULIJA 1998 OB 18.03 URI.)</stage>
               <idno>SDZ2-Izredna-23-1998-07-09.stage256</idno>
            </item>
            <item>
               <stage>(SEJA JE BILA PREKINJENA 9. JUNIJA 1999 OB 18.52 URI.)</stage>
               <idno>SDZ2-Redna-14-1999-06-09.stage271</idno>
            </item>
            <item>
               <stage>(SEJA JE BILA PREKINJENA DNE 1. APRILA 1999 OB 18.15 URI.)</stage>
               <idno>SDZ2-Redna-12-1999-04-01.stage280</idno>
            </item>
            <item>
               <stage>(SEJA JE BILA PREKINJENA DNE 1.3.2000 OB 17.55 URI.)</stage>
               <idno>SDZ2-Redna-19-2000-03-01.stage22</idno>
            </item>
            <item>
               <stage>(SEJA JE BILA PREKINJENA DNE 10.12.1998 OB 20.01 URI.)</stage>
               <idno>SDZ2-Izredna-29-1998-12-10.stage45</idno>
            </item>
            <item>
               <stage>(SEJA JE BILA PREKINJENA DNE 10.3.1999 OB 20.06 URI.)</stage>
               <idno>SDZ2-Redna-11-1999-03-10.stage558</idno>
            </item>
            <item>
               <stage>(SEJA JE BILA PREKINJENA DNE 11. FEBRUARJA 1999 OB 17.54 URI.)</stage>
               <idno>SDZ2-Izredna-32-1999-02-11.stage50</idno>
            </item>
            <item>
               <stage>(SEJA JE BILA PREKINJENA DNE 11.11.1998 OB 17.32 URI.)</stage>
               <idno>SDZ2-Izredna-28-1998-11-11.stage249</idno>
            </item>
            <item>
               <stage>(SEJA JE BILA PREKINJENA DNE 12. FEBRUARJA 1999 OB 14.14 URI.)</stage>
               <idno>SDZ2-Izredna-32-1999-02-12.stage16</idno>
            </item>
            <item>
               <stage>(SEJA JE BILA PREKINJENA DNE 12. MAJA 2000 OB 13.29 URI.)</stage>
               <idno>SDZ2-Redna-21-2000-05-12.stage92</idno>
            </item>
            <item>
               <stage>(SEJA JE BILA PREKINJENA DNE 12.11.1998 OB 12.19 URI.)</stage>
               <idno>SDZ2-Izredna-28-1998-11-12.stage25</idno>
            </item>
            <item>
               <stage>(SEJA JE BILA PREKINJENA DNE 12.5.1999 OB 19.07 URI.)</stage>
               <idno>SDZ2-Redna-13-1999-05-12.stage559</idno>
            </item>
            <item>
               <stage>(SEJA JE BILA PREKINJENA DNE 12.6.1998 OB 14.05 URI.)</stage>
               <idno>SDZ2-Redna-09-1998-06-12.stage93</idno>
            </item>
            <item>
               <stage>(SEJA JE BILA PREKINJENA DNE 13. OKTOBRA 1999 OB 18.03 URI.)</stage>
               <idno>SDZ2-Redna-16-1999-10-13.stage129</idno>
            </item>
            <item>
               <stage>(SEJA JE BILA PREKINJENA DNE 13.4.1999 OB 19.00 URI.)</stage>
               <idno>SDZ2-Redna-12-1999-04-13.stage81</idno>
            </item>
            <item>
               <stage>(SEJA JE BILA PREKINJENA DNE 13.4.2000 OB 18.05 URI.)</stage>
               <idno>SDZ2-Redna-21-2000-04-13.stage217</idno>
            </item>
            <item>
               <stage>(SEJA JE BILA PREKINJENA DNE 14. SEPTEMBRA 2000 OB 17.24 URI.)</stage>
               <idno>SDZ2-Izredna-55-2000-09-14.stage285</idno>
            </item>
            <item>
               <stage>(SEJA JE BILA PREKINJENA DNE 14.4.1999 OB 17.58 URI.)</stage>
               <idno>SDZ2-Redna-12-1999-04-14.stage57</idno>
            </item>
            <item>
               <stage>(SEJA JE BILA PREKINJENA DNE 15. OKTOBRA 1997 OB 17.39 URI.)</stage>
               <idno>SDZ2-Izredna-15-1997-10-15.stage66</idno>
            </item>
            <item>
               <stage>(SEJA JE BILA PREKINJENA DNE 15.12.1998 OB 17.29 URI.)</stage>
               <idno>SDZ2-Izredna-30-1998-12-15.stage302</idno>
            </item>
            <item>
               <stage>(SEJA JE BILA PREKINJENA DNE 15.3.2000 OB 17.53 URI.)</stage>
               <idno>SDZ2-Redna-19-2000-03-15.stage30</idno>
            </item>
            <item>
               <stage>(SEJA JE BILA PREKINJENA DNE 16. APRILA 1998 OB 19.22 URI.)</stage>
               <idno>SDZ2-Izredna-21-1998-04-16.stage224</idno>
            </item>
            <item>
               <stage>(SEJA JE BILA PREKINJENA DNE 16. FEBRUARJA 2000 OB 17.58 URI.)</stage>
               <idno>SDZ2-Redna-18-2000-02-16.stage124</idno>
            </item>
            <item>
               <stage>(SEJA JE BILA PREKINJENA DNE 16.12.1998 OB 18.01 URI.)</stage>
               <idno>SDZ2-Izredna-30-1998-12-16.stage523</idno>
            </item>
            <item>
               <stage>(SEJA JE BILA PREKINJENA DNE 16.3.1999 OB 19.06 URI.)</stage>
               <idno>SDZ2-Redna-11-1999-03-16.stage109</idno>
            </item>
            <item>
               <stage>(SEJA JE BILA PREKINJENA DNE 18. SEPTEMBRA 1998 OB 17.22 URI.)</stage>
               <idno>SDZ2-Izredna-24-1998-09-18.stage56</idno>
            </item>
            <item>
               <stage>(SEJA JE BILA PREKINJENA DNE 18.2.1999 OB 18.09 URI.)</stage>
               <idno>SDZ2-Redna-11-1999-02-18.stage73</idno>
            </item>
            <item>
               <stage>(SEJA JE BILA PREKINJENA DNE 18.5.1999 OB 18.24 URI.)</stage>
               <idno>SDZ2-Redna-14-1999-05-18.stage126</idno>
            </item>
            <item>
               <stage>(SEJA JE BILA PREKINJENA DNE 19. JANUARJA 1999 OB 17.07 URI.)</stage>
               <idno>SDZ2-Izredna-31-1999-01-19.stage208</idno>
            </item>
            <item>
               <stage>(SEJA JE BILA PREKINJENA DNE 19.4.2000 OB 21.56 URI.)</stage>
               <idno>SDZ2-Izredna-45-2000-04-19.stage30</idno>
            </item>
            <item>
               <stage>(SEJA JE BILA PREKINJENA DNE 19.5.1999 OB 18.02 URI.)</stage>
               <idno>SDZ2-Redna-14-1999-05-19.stage819</idno>
            </item>
            <item>
               <stage>(SEJA JE BILA PREKINJENA DNE 20. APRILA 1999 OB 19.30 URI.)</stage>
               <idno>SDZ2-Redna-13-1999-04-20.stage167</idno>
            </item>
            <item>
               <stage>(SEJA JE BILA PREKINJENA DNE 20.1.1999 OB 17.40 URI.)</stage>
               <idno>SDZ2-Izredna-31-1999-01-20.stage138</idno>
            </item>
            <item>
               <stage>(SEJA JE BILA PREKINJENA DNE 21.4.1999 OB 18.04 URI.)</stage>
               <idno>SDZ2-Redna-13-1999-04-21.stage283</idno>
            </item>
            <item>
               <stage>(SEJA JE BILA PREKINJENA DNE 23. JULIJA 1998 OB 18.04 URI.)</stage>
               <idno>SDZ2-Redna-10-1998-07-23.stage142</idno>
            </item>
            <item>
               <stage>(SEJA JE BILA PREKINJENA DNE 23.4.1999 OB 14.15 URI.)</stage>
               <idno>SDZ2-Redna-13-1999-04-23.stage105</idno>
            </item>
            <item>
               <stage>(SEJA JE BILA PREKINJENA DNE 24.2.1999 OB 19.19 URI.)</stage>
               <idno>SDZ2-Redna-11-1999-02-24.stage49</idno>
            </item>
            <item>
               <stage>(SEJA JE BILA PREKINJENA DNE 24.2.2000 OB 17.55 URI.)</stage>
               <idno>SDZ2-Redna-19-2000-02-24.stage280</idno>
            </item>
            <item>
               <stage>(SEJA JE BILA PREKINJENA DNE 24.3.1999 OB 19.49 URI.)</stage>
               <idno>SDZ2-Redna-12-1999-03-24.stage358</idno>
            </item>
            <item>
               <stage>(SEJA JE BILA PREKINJENA DNE 24.6.1999 OB 13.01 URI.)</stage>
               <idno>SDZ2-Redna-15-1999-06-24.stage139</idno>
            </item>
            <item>
               <stage>(SEJA JE BILA PREKINJENA DNE 25. FEBRUARJA 1998 OB 18.08 URI.)</stage>
               <idno>SDZ2-Redna-08-1998-02-25.stage262</idno>
            </item>
            <item>
               <stage>(SEJA JE BILA PREKINJENA DNE 25. NOVEMBRA 1998 OB 17.22 URI.)</stage>
               <idno>SDZ2-Izredna-29-1998-11-25.stage327</idno>
            </item>
            <item>
               <stage>(SEJA JE BILA PREKINJENA DNE 25.11.1998 OB 10.22 URI.)</stage>
               <idno>SDZ2-Redna-10-1998-11-25.stage11</idno>
            </item>
            <item>
               <stage>(SEJA JE BILA PREKINJENA DNE 25.2.1999 OB 18.05 URI.)</stage>
               <idno>SDZ2-Redna-11-1999-02-25.stage102</idno>
            </item>
            <item>
               <stage>(SEJA JE BILA PREKINJENA DNE 25.4.2000 OB 17.47 URI.)</stage>
               <idno>SDZ2-Redna-21-2000-04-25.stage264</idno>
            </item>
            <item>
               <stage>(SEJA JE BILA PREKINJENA DNE 25.9.1998 OB 13.14 URI.)</stage>
               <idno>SDZ2-Redna-10-1998-09-25.stage105</idno>
            </item>
            <item>
               <stage>(SEJA JE BILA PREKINJENA DNE 26. APRILA 2000 OB 18.31 URI.)</stage>
               <idno>SDZ2-Izredna-46-2000-04-26.stage46</idno>
            </item>
            <item>
               <stage>(SEJA JE BILA PREKINJENA DNE 26. FEBRUARJA 1999 OB 12.54 URI.)</stage>
               <idno>SDZ2-Redna-11-1999-02-26.stage188</idno>
            </item>
            <item>
               <stage>(SEJA JE BILA PREKINJENA DNE 27. FEBRUARJA 1998 OB 13.08 URI.)</stage>
               <idno>SDZ2-Redna-08-1998-02-27.stage12</idno>
            </item>
            <item>
               <stage>(SEJA JE BILA PREKINJENA DNE 27.3.1998, OB 14.05 URI.)</stage>
               <idno>SDZ2-Redna-08-1998-03-27.stage94</idno>
            </item>
            <item>
               <stage>(SEJA JE BILA PREKINJENA DNE 28. JANUARJA 2000 OB 13.58 URI.)</stage>
               <idno>SDZ2-Redna-18-2000-01-28.stage29</idno>
            </item>
            <item>
               <stage>(SEJA JE BILA PREKINJENA DNE 28.5.1999 OB 14.01 URI.)</stage>
               <idno>SDZ2-Redna-14-1999-05-28.stage70</idno>
            </item>
            <item>
               <stage>(SEJA JE BILA PREKINJENA DNE 29. APRILA 1999 OB 17.59 URI.)</stage>
               <idno>SDZ2-Redna-13-1999-04-29.stage226</idno>
            </item>
            <item>
               <stage>(SEJA JE BILA PREKINJENA DNE 29. AVGUSTA 2000 OB 19.05 URI.)</stage>
               <idno>SDZ2-Izredna-54-2000-08-29.stage313</idno>
            </item>
            <item>
               <stage>(SEJA JE BILA PREKINJENA DNE 29. MAJA 1998 OB 14.12 URI.)</stage>
               <idno>SDZ2-Redna-09-1998-05-29.stage460</idno>
            </item>
            <item>
               <stage>(SEJA JE BILA PREKINJENA DNE 29.1.1999 OB 13.51 URI.)</stage>
               <idno>SDZ2-Izredna-32-1999-01-29.stage35</idno>
            </item>
            <item>
               <stage>(SEJA JE BILA PREKINJENA DNE 29.10.1998 OB 17.15 URI.)</stage>
               <idno>SDZ2-Izredna-28-1998-10-29.stage21</idno>
            </item>
            <item>
               <stage>(SEJA JE BILA PREKINJENA DNE 3. DECEMBRA 1998 OB 16.48 URI.)</stage>
               <idno>SDZ2-Izredna-29-1998-12-03.stage193</idno>
            </item>
            <item>
               <stage>(SEJA JE BILA PREKINJENA DNE 30. MARCA 1999 OB 19.42 URI.)</stage>
               <idno>SDZ2-Redna-12-1999-03-30.stage35</idno>
            </item>
            <item>
               <stage>(SEJA JE BILA PREKINJENA DNE 30.10.1998 OB 12.30 URI.)</stage>
               <idno>SDZ2-Izredna-28-1998-10-30.stage42</idno>
            </item>
            <item>
               <stage>(SEJA JE BILA PREKINJENA DNE 30.9.1998 OB 18.01 URI.)</stage>
               <idno>SDZ2-Redna-10-1998-09-30.stage248</idno>
            </item>
            <item>
               <stage>(SEJA JE BILA PREKINJENA DNE 30.SEPTEMBRA 1999 OB 17.43 URI.)</stage>
               <idno>SDZ2-Redna-16-1999-09-30.stage762</idno>
            </item>
            <item>
               <stage>(SEJA JE BILA PREKINJENA DNE 31. MARCA 1999 OB 17.59 URI.)</stage>
               <idno>SDZ2-Redna-12-1999-03-31.stage200</idno>
            </item>
            <item>
               <stage>(SEJA JE BILA PREKINJENA DNE 8.6.1999 OB 19.03 URI.)</stage>
               <idno>SDZ2-Redna-14-1999-06-08.stage446</idno>
            </item>
            <item>
               <stage>(SEJA JE BILA PREKINJENA DNE 8.7.1999 OB 18.01 URI.)</stage>
               <idno>SDZ2-Izredna-37-1999-07-08.stage385</idno>
            </item>
            <item>
               <stage>(SEJA JE BILA PREKINJENA DNE 9. JULIJA 1999 OB 14.02 URI.)</stage>
               <idno>SDZ2-Izredna-37-1999-07-09.stage41</idno>
            </item>
            <item>
               <stage>(SEJA JE BILA PREKINJENA DNE 9.2.1999 OB 18.05 URI.)</stage>
               <idno>SDZ2-Izredna-32-1999-02-09.stage53</idno>
            </item>
            <item>
               <stage>(SEJA JE BILA PREKINJENA V TOREK, 9. MARCA 1999 OB 19.56 URI.)</stage>
               <idno>SDZ2-Redna-11-1999-03-09.stage384</idno>
            </item>
            <item>
               <stage>(SEJA JE BILA PREKINJENJA 13. NOVEMBRA 1998 OB 13.47 URI.)</stage>
               <idno>SDZ2-Redna-10-1998-11-13.stage218</idno>
            </item>
            <item>
               <stage>(SEJA JE BILA ZAKLJUENA 24. SEPTEMBRA 1998 OB 15.23 URI.)</stage>
               <idno>SDZ2-Izredna-24-1998-09-24.stage38</idno>
            </item>
            <item>
               <stage>(SEJA JE BLA PREKINJENA 4. JUNIJA 1997 OB 17.08 URI.)</stage>
               <idno>SDZ2-Redna-05-1997-06-04.stage183</idno>
            </item>
            <item>
               <stage>(SEJA JE PREKINJENA 15. MAJA 1997 OB 17.18 URI.)</stage>
               <idno>SDZ2-Redna-04-1997-05-15.stage259</idno>
            </item>
            <item>
               <stage>(SEJE JE BILA PREKINJENA 16. DECEMBRA 1997 OB 21.39 URI.)</stage>
               <idno>SDZ2-Izredna-17-1997-12-16.stage177</idno>
            </item>
            <item>
               <stage>(Seja je bil prekinjena ob 10.13 uri in se je nadaljevala ob 10.24 uri.)</stage>
               <idno>SDZ2-Redna-08-1998-03-27.stage9</idno>
            </item>
            <item>
               <stage>(Seja je bila konana 10. septembra 1997 ob 13.19 uri.)</stage>
               <idno>SDZ2-Izredna-13-1997-09-10.stage45</idno>
            </item>
            <item>
               <stage>(Seja je bila konana 11. julija 1997 ob 18.32 uri.)</stage>
               <idno>SDZ2-Izredna-09-1997-07-11.stage359</idno>
            </item>
            <item>
               <stage>(Seja je bila konana 11. julija 2000 ob 17.23 uri.)</stage>
               <idno>SDZ2-Izredna-51-2000-07-11.stage27</idno>
            </item>
            <item>
               <stage>(Seja je bila konana 12. decembra 1997 ob 12.17 uri.)</stage>
               <idno>SDZ2-Izredna-16-1997-12-12.stage19</idno>
            </item>
            <item>
               <stage>(Seja je bila konana 12. junija 1997 ob 17.19 uri.)</stage>
               <idno>SDZ2-Izredna-06-1997-06-12.stage42</idno>
            </item>
            <item>
               <stage>(Seja je bila konana 12. junija 1997 ob 18.29 uri.)</stage>
               <idno>SDZ2-Redna-05-1997-06-12.stage82</idno>
            </item>
            <item>
               <stage>(Seja je bila konana 14. julija 1997 ob 20.36 uri.)</stage>
               <idno>SDZ2-Izredna-10-1997-07-14.stage33</idno>
            </item>
            <item>
               <stage>(Seja je bila konana 15. julija 1997 ob 17.07 uri.)</stage>
               <idno>SDZ2-Izredna-11-1997-07-15.stage56</idno>
            </item>
            <item>
               <stage>(Seja je bila konana 16. Oktobra 1998 ob 12.00 uri.)</stage>
               <idno>SDZ2-Izredna-25-1998-10-16.stage28</idno>
            </item>
            <item>
               <stage>(Seja je bila konana 16. februarja 1999 ob 21.42 uri.)</stage>
               <idno>SDZ2-Izredna-32-1999-02-16.stage46</idno>
            </item>
            <item>
               <stage>(Seja je bila konana 16. januarja 1997 ob 17.18 uri.)</stage>
               <idno>SDZ2-Izredna-01-1997-01-16.stage136</idno>
            </item>
            <item>
               <stage>(Seja je bila konana 16. oktobra 1997 ob 16.44. uri.)</stage>
               <idno>SDZ2-Izredna-15-1997-10-16.stage219</idno>
            </item>
            <item>
               <stage>(Seja je bila konana 19. februarja 1997 ob 15.45 uri.)</stage>
               <idno>SDZ2-Redna-02-1997-02-19.stage361</idno>
            </item>
            <item>
               <stage>(Seja je bila konana 2. novembra 1999 ob 14.15 uri.)</stage>
               <idno>SDZ2-Redna-16-1999-11-02.stage22</idno>
            </item>
            <item>
               <stage>(Seja je bila konana 20. aprila 2000 ob 18.21 uri.)</stage>
               <idno>SDZ2-Izredna-45-2000-04-20.stage38</idno>
            </item>
            <item>
               <stage>(Seja je bila konana 21. julija 2000 ob 13.32 uri.)</stage>
               <idno>SDZ2-Izredna-52-2000-07-21.stage149</idno>
            </item>
            <item>
               <stage>(Seja je bila konana 21. maja 1997 ob 15.27 uri.)</stage>
               <idno>SDZ2-Redna-04-1997-05-21.stage462</idno>
            </item>
            <item>
               <stage>(Seja je bila konana 22. decembra 1997 ob 14.43 uri.)</stage>
               <idno>SDZ2-Izredna-17-1997-12-22.stage9</idno>
            </item>
            <item>
               <stage>(Seja je bila konana 23. decembra 1998 ob 12.00 uri.)</stage>
               <idno>SDZ2-Izredna-30-1998-12-23.stage49</idno>
            </item>
            <item>
               <stage>(Seja je bila konana 23. maja 1997 ob 19.18 uri.)</stage>
               <idno>SDZ2-Izredna-04-1997-05-23.stage93</idno>
            </item>
            <item>
               <stage>(Seja je bila konana 23. maja 2000 ob 23.41 uri.)</stage>
               <idno>SDZ2-Izredna-48-2000-05-23.stage31</idno>
            </item>
            <item>
               <stage>(Seja je bila konana 24. aprila 1998 ob 12.55. uri.)</stage>
               <idno>SDZ2-Redna-08-1998-04-24.stage42</idno>
            </item>
            <item>
               <stage>(Seja je bila konana 24. aprila 1998 ob 12.57 uri.)</stage>
               <idno>SDZ2-Izredna-21-1998-04-24.stage10</idno>
            </item>
            <item>
               <stage>(Seja je bila konana 25. marca 1998 ob 18.08 uri.)</stage>
               <idno>SDZ2-Izredna-20-1998-03-25.stage122</idno>
            </item>
            <item>
               <stage>(Seja je bila konana 26. oktobra 1999 ob 17.29 uri.)</stage>
               <idno>SDZ2-Izredna-41-1999-10-26.stage23</idno>
            </item>
            <item>
               <stage>(Seja je bila konana 27. februarja 1997 ob 19.17 uri.)</stage>
               <idno>SDZ2-Izredna-03-1997-02-27.stage50</idno>
            </item>
            <item>
               <stage>(Seja je bila konana 27. januarja 1999 ob 18.05 uri.)</stage>
               <idno>SDZ2-Redna-10-1999-01-27.stage348</idno>
            </item>
            <item>
               <stage>(Seja je bila konana 27. septembra 1997 ob 4.00 uri.)</stage>
               <idno>SDZ2-Izredna-14-1997-09-26.stage82</idno>
            </item>
            <item>
               <stage>(Seja je bila konana 28.7.2000 ob 13.52 uri.)</stage>
               <idno>SDZ2-Izredna-53-2000-07-28.stage30</idno>
            </item>
            <item>
               <stage>(Seja je bila konana 3. aprila 1997 ob 18.10 uri.)</stage>
               <idno>SDZ2-Redna-03-1997-04-03.stage145</idno>
            </item>
            <item>
               <stage>(Seja je bila konana 3. decembra 1996 ob 17.38 uri.)</stage>
               <idno>SDZ2-Redna-01-1996-12-03.stage25</idno>
            </item>
            <item>
               <stage>(Seja je bila konana 3. maja 2000 ob 17.54 uri.)</stage>
               <idno>SDZ2-Izredna-47-2000-05-03.stage38</idno>
            </item>
            <item>
               <stage>(Seja je bila konana 30. junija 1998 ob 18.05 uri.)</stage>
               <idno>SDZ2-Redna-09-1998-06-30.stage120</idno>
            </item>
            <item>
               <stage>(Seja je bila konana 30. junija 1999 ob 20.08 uri.)</stage>
               <idno>SDZ2-Redna-15-1999-06-30.stage361</idno>
            </item>
            <item>
               <stage>(Seja je bila konana 31. julija 1997 ob 14.26 uri.)</stage>
               <idno>SDZ2-Izredna-12-1997-07-31.stage169</idno>
            </item>
            <item>
               <stage>(Seja je bila konana 4. februarja 1998 ob 16.53 uri.)</stage>
               <idno>SDZ2-Redna-07-1998-02-04.stage582</idno>
            </item>
            <item>
               <stage>(Seja je bila konana 6. februarja 1997 ob 21.20 uri.)</stage>
               <idno>SDZ2-Izredna-02-1997-02-06.stage32</idno>
            </item>
            <item>
               <stage>(Seja je bila konana 6. junija 1997 ob 12.52 uri.)</stage>
               <idno>SDZ2-Izredna-05-1997-06-06.stage22</idno>
            </item>
            <item>
               <stage>(Seja je bila konana 9. julija 1997 ob 10.19 uri.)</stage>
               <idno>SDZ2-Izredna-08-1997-07-09.stage16</idno>
            </item>
            <item>
               <stage>(Seja je bila konana 9. oktobera 1997 ob 18.07 uri.)</stage>
               <idno>SDZ2-Redna-06-1997-10-09.stage567</idno>
            </item>
            <item>
               <stage>(Seja je bila konana dne 13. junija 2000 ob 17.44 uri.)</stage>
               <idno>SDZ2-Redna-21-2000-06-13.stage243</idno>
            </item>
            <item>
               <stage>(Seja je bila konana dne 17. marca 1999 ob 14.58 uri.)</stage>
               <idno>SDZ2-Redna-11-1999-03-17.stage43</idno>
            </item>
            <item>
               <stage>(Seja je bila konana dne 2. junija 2000 ob 13.27 uri.)</stage>
               <idno>SDZ2-Izredna-49-2000-06-02.stage302</idno>
            </item>
            <item>
               <stage>(Seja je bila konana dne 27.10.1998 ob 17.34 uri.)</stage>
               <idno>SDZ2-Izredna-27-1998-10-27.stage63</idno>
            </item>
            <item>
               <stage>(Seja je bila konana dne 4. februarja 1998 ob 11.21 uri.)</stage>
               <idno>SDZ2-Izredna-19-1998-02-04.stage151</idno>
            </item>
            <item>
               <stage>(Seja je bila prekinja ob 13.01 uri in se je nadaljevala ob 14.39 uri.)</stage>
               <idno>SDZ2-Izredna-42-1999-12-22.stage24</idno>
            </item>
            <item>
               <stage>(Seja je bila prekinjana ob 00.40 uri in se je nadaljevala ob 01.14 uri.)</stage>
               <idno>SDZ2-Redna-09-1998-05-20.stage69</idno>
            </item>
            <item>
               <stage>(Seja je bila prekinjana ob 13.30 uri in se je nadaljevala ob 15.06 uri.)</stage>
               <idno>SDZ2-Izredna-38-1999-07-29.stage20</idno>
            </item>
            <item>
               <stage>(Seja je bila prekinjena 12.32 uri in se je nadaljevala ob 12.48 uri.)</stage>
               <idno>SDZ2-Redna-08-1998-04-24.stage32</idno>
            </item>
            <item>
               <stage>(Seja je bila prekinjena 13.04 uri in se je nadaljevala ob 14.36 uri.)</stage>
               <idno>SDZ2-Redna-16-1999-09-22.stage168</idno>
            </item>
            <item>
               <stage>(Seja je bila prekinjena 14. maja 1997 ob 11.08 uri.)</stage>
               <idno>SDZ2-Izredna-04-1997-05-14.stage8</idno>
            </item>
            <item>
               <stage>(Seja je bila prekinjena bo 10.26 uri in se je nadaljevala ob 10.59 uri.)</stage>
               <idno>SDZ2-Redna-09-1998-06-18.stage12</idno>
            </item>
            <item>
               <stage>(Seja je bila prekinjena bo 14.41 uri in se je nadaljevala ob 14.56 uri.)</stage>
               <idno>SDZ2-Izredna-54-2000-09-05.stage35</idno>
            </item>
            <item>
               <stage>(Seja je bila prekinjena in se je nadaljevala ob 11.55 uri.)</stage>
               <idno>SDZ2-Izredna-12-1997-07-30.stage8</idno>
            </item>
            <item>
               <stage>(Seja je bila prekinjena in se je nadaljevala ob 17.18 uri.)</stage>
               <idno>SDZ2-Redna-04-1997-05-20.stage234</idno>
            </item>
            <item>
               <stage>(Seja je bila prekinjena in se je nadaljevala ob 17.26 uri.)</stage>
               <idno>SDZ2-Redna-04-1997-05-20.stage238</idno>
            </item>
            <item>
               <stage>(Seja je bila prekinjena ob ... uri in se je nadaljevala ob 16.47 uri.)</stage>
               <idno>SDZ2-Redna-01-1996-12-02.stage18</idno>
            </item>
            <item>
               <stage>(Seja je bila prekinjena ob 10.05 uri.)</stage>
               <idno>SDZ2-Izredna-15-1997-10-01.stage5</idno>
            </item>
            <item>
               <stage>(Seja je bila prekinjena ob 10.10 uri in se je nadaljevala ob 10.25 uri.)</stage>
               <idno>SDZ2-Izredna-28-1998-11-11.stage7</idno>
            </item>
            <item>
               <stage>(Seja je bila prekinjena ob 10.10 uri in se je nadaljevala ob 10.26 uri.)</stage>
               <idno>SDZ2-Redna-08-1998-04-02.stage5</idno>
            </item>
            <item>
               <stage>(Seja je bila prekinjena ob 10.10 uri in se je nadaljevala ob 14.34 uri.)</stage>
               <idno>SDZ2-Redna-01-1996-12-03.stage6</idno>
            </item>
            <item>
               <stage>(Seja je bila prekinjena ob 10.11 uri in se je nadaljevala ob 10.12 uri.)</stage>
               <idno>SDZ2-Redna-12-1999-04-15.stage6</idno>
            </item>
            <item>
               <stage>(Seja je bila prekinjena ob 10.11 uri in se je nadaljevala ob 10.23 uri.)</stage>
               <idno>SDZ2-Izredna-28-1998-10-30.stage7</idno>
            </item>
            <item>
               <stage>(Seja je bila prekinjena ob 10.12 uri in se je nadaljevala ob 10.22 uri.)</stage>
               <idno>SDZ2-Izredna-19-1998-01-21.stage5</idno>
            </item>
            <item>
               <stage>(Seja je bila prekinjena ob 10.12 uri in se je nadaljevala ob 10.23 uri.)</stage>
               <idno>SDZ2-Izredna-22-1998-05-15.stage6</idno>
            </item>
            <item>
               <stage>(Seja je bila prekinjena ob 10.12 uri in se je nadaljevala ob 10.26 uri.)</stage>
               <idno>SDZ2-Izredna-25-1998-10-02.stage7</idno>
            </item>
            <item>
               <stage>(Seja je bila prekinjena ob 10.12 uri in se je nadaljevala ob 11.09 uri.)</stage>
               <idno>SDZ2-Izredna-25-1998-10-01.stage5</idno>
            </item>
            <item>
               <stage>(Seja je bila prekinjena ob 10.13 minut in se je nadaljevala ob 10.31 uri.)</stage>
               <idno>SDZ2-Izredna-54-2000-09-01.stage6</idno>
            </item>
            <item>
               <stage>(Seja je bila prekinjena ob 10.13 uri in se je nadaljevala ob 11.00 uri.)</stage>
               <idno>SDZ2-Izredna-23-1998-07-09.stage5</idno>
            </item>
            <item>
               <stage>(Seja je bila prekinjena ob 10.14 uri in se je nadaljevala ob 10.22 uri.)</stage>
               <idno>SDZ2-Izredna-39-1999-09-16.stage6</idno>
            </item>
            <item>
               <stage>(Seja je bila prekinjena ob 10.14 uri in se je nadaljevala ob 10.25 uri.)</stage>
               <idno>SDZ2-Redna-21-2000-05-11.stage20</idno>
            </item>
            <item>
               <stage>(Seja je bila prekinjena ob 10.14 uri in se je nadaljevala ob 10.26 uri.)</stage>
               <idno>SDZ2-Izredna-29-1998-12-04.stage6</idno>
            </item>
            <item>
               <stage>(Seja je bila prekinjena ob 10.14 uri in se je nadaljevala ob 10.27 uri.)</stage>
               <idno>SDZ2-Redna-05-1997-05-30.stage7</idno>
            </item>
            <item>
               <stage>(Seja je bila prekinjena ob 10.15 uri in se je nadaljevala ob 10.25 uri.)</stage>
               <idno>SDZ2-Redna-10-1998-09-30.stage13 SDZ2-Redna-14-1999-05-28.stage11</idno>
            </item>
            <item>
               <stage>(Seja je bila prekinjena ob 10.15 uri in se je nadaljevala ob 10.59 uri.)</stage>
               <idno>SDZ2-Redna-15-1999-06-23.stage15</idno>
            </item>
            <item>
               <stage>(Seja je bila prekinjena ob 10.15 uri in se je nadaljevala ob 11.05 uri.)</stage>
               <idno>SDZ2-Redna-04-1997-04-29.stage9</idno>
            </item>
            <item>
               <stage>(Seja je bila prekinjena ob 10.17 uri in se je nadaljevala ob 10.27 uri.)</stage>
               <idno>SDZ2-Redna-17-1999-11-19.stage11</idno>
            </item>
            <item>
               <stage>(Seja je bila prekinjena ob 10.18 uri in se je nadaljevala ob 10.29 uri.)</stage>
               <idno>SDZ2-Redna-19-2000-02-23.stage28</idno>
            </item>
            <item>
               <stage>(Seja je bila prekinjena ob 10.18 uri in se je nadaljevala ob 11.00 uri.)</stage>
               <idno>SDZ2-Redna-05-1997-05-22.stage10</idno>
            </item>
            <item>
               <stage>(Seja je bila prekinjena ob 10.19 uri in se je nadaljevala ob 10.39 uri.)</stage>
               <idno>SDZ2-Izredna-28-1998-11-12.stage13</idno>
            </item>
            <item>
               <stage>(Seja je bila prekinjena ob 10.19 uri in se je nadaljevala ob 11.23 uri.)</stage>
               <idno>SDZ2-Redna-07-1997-11-20.stage6</idno>
            </item>
            <item>
               <stage>(Seja je bila prekinjena ob 10.19 uri in se je nadaljevala ob 13.19 uri.)</stage>
               <idno>SDZ2-Izredna-46-2000-04-28.stage11</idno>
            </item>
            <item>
               <stage>(Seja je bila prekinjena ob 10.20 uri in se je nadaljevala ob 10.53 uri.)</stage>
               <idno>SDZ2-Redna-09-1998-05-29.stage11</idno>
            </item>
            <item>
               <stage>(Seja je bila prekinjena ob 10.20 uri in se je nadaljevala ob 11.12 uri.)</stage>
               <idno>SDZ2-Izredna-43-2000-01-21.stage6</idno>
            </item>
            <item>
               <stage>(Seja je bila prekinjena ob 10.20 uri in se je nadaljevala ob 11.31 uri.)</stage>
               <idno>SDZ2-Redna-11-1999-02-26.stage82</idno>
            </item>
            <item>
               <stage>(Seja je bila prekinjena ob 10.22 uri in se je nadaljevala ob 11.01 uri.)</stage>
               <idno>SDZ2-Izredna-44-2000-04-08.stage7</idno>
            </item>
            <item>
               <stage>(Seja je bila prekinjena ob 10.22 uri in se je nadaljevala ob 11.15 uri.)</stage>
               <idno>SDZ2-Redna-05-1997-05-29.stage13</idno>
            </item>
            <item>
               <stage>(Seja je bila prekinjena ob 10.23 uri in se je nadaljevala ob 10.30 uri.)</stage>
               <idno>SDZ2-Redna-10-1999-01-27.stage28</idno>
            </item>
            <item>
               <stage>(Seja je bila prekinjena ob 10.23 uri in se je nadaljevala ob 10.38 uri.)</stage>
               <idno>SDZ2-Redna-11-1999-02-19.stage9</idno>
            </item>
            <item>
               <stage>(Seja je bila prekinjena ob 10.24 uri in se je nadaljevala ob 10.35 uri.)</stage>
               <idno>SDZ2-Izredna-24-1998-09-18.stage7</idno>
            </item>
            <item>
               <stage>(Seja je bila prekinjena ob 10.25 uri in se je nadaljevala ob 10.37 uri.)</stage>
               <idno>SDZ2-Redna-10-1998-11-13.stage8</idno>
            </item>
            <item>
               <stage>(Seja je bila prekinjena ob 10.25 uri in se je nadaljevala ob 10.40 uri.)</stage>
               <idno>SDZ2-Izredna-19-1998-02-04.stage22</idno>
            </item>
            <item>
               <stage>(Seja je bila prekinjena ob 10.25 uri in se je nadaljevala ob 10.45 uri.)</stage>
               <idno>SDZ2-Izredna-24-1998-09-16.stage16</idno>
            </item>
            <item>
               <stage>(Seja je bila prekinjena ob 10.25 uri in se je nadaljevala ob 10.47 uri.)</stage>
               <idno>SDZ2-Redna-12-1999-03-31.stage22</idno>
            </item>
            <item>
               <stage>(Seja je bila prekinjena ob 10.26 uri in se je nadaljevala ob 10.39 uri.)</stage>
               <idno>SDZ2-Redna-05-1997-06-04.stage7</idno>
            </item>
            <item>
               <stage>(Seja je bila prekinjena ob 10.26 uri insejenadaljevala ob 11.37 uri.)</stage>
               <idno>SDZ2-Redna-08-1998-03-05.stage5</idno>
            </item>
            <item>
               <stage>(Seja je bila prekinjena ob 10.27 uri in se je nadaljevala ob 10.43 uri.)</stage>
               <idno>SDZ2-Redna-10-1998-07-24.stage8</idno>
            </item>
            <item>
               <stage>(Seja je bila prekinjena ob 10.27 uri in se je nadaljevala ob 12.14 uri.)</stage>
               <idno>SDZ2-Izredna-54-2000-08-31.stage6</idno>
            </item>
            <item>
               <stage>(Seja je bila prekinjena ob 10.28 uri in se je nadaljevala ob 10.38 uri.)</stage>
               <idno>SDZ2-Redna-09-1998-06-12.stage34</idno>
            </item>
            <item>
               <stage>(Seja je bila prekinjena ob 10.30 uri in se je nadaljevala ob 10.41 uri.)</stage>
               <idno>SDZ2-Redna-14-1999-05-28.stage24</idno>
            </item>
            <item>
               <stage>(Seja je bila prekinjena ob 10.30 uri in se je nadaljevala ob 10.42 uri.)</stage>
               <idno>SDZ2-Izredna-54-2000-09-06.stage23</idno>
            </item>
            <item>
               <stage>(Seja je bila prekinjena ob 10.30 uri in se je nadaljevala ob 10.43 uri.)</stage>
               <idno>SDZ2-Redna-19-2000-03-17.stage11</idno>
            </item>
            <item>
               <stage>(Seja je bila prekinjena ob 10.30 uri in se je nadaljevala ob 10.47 uri.)</stage>
               <idno>SDZ2-Redna-20-2000-03-22.stage27</idno>
            </item>
            <item>
               <stage>(Seja je bila prekinjena ob 10.30 uri in se je nadaljevala ob 10.50 uri.)</stage>
               <idno>SDZ2-Redna-08-1998-03-18.stage9</idno>
            </item>
            <item>
               <stage>(Seja je bila prekinjena ob 10.31 uri in se je nadaljevala ob 10.52 uri.)</stage>
               <idno>SDZ2-Redna-08-1998-02-26.stage7</idno>
            </item>
            <item>
               <stage>(Seja je bila prekinjena ob 10.31 uri in se je nadaljevala ob 12.04 uri.)</stage>
               <idno>SDZ2-Redna-15-1999-06-17.stage13</idno>
            </item>
            <item>
               <stage>(Seja je bila prekinjena ob 10.32 uri in se je nadaljevala ob 10.46 uri.)</stage>
               <idno>SDZ2-Redna-10-1998-09-30.stage19</idno>
            </item>
            <item>
               <stage>(Seja je bila prekinjena ob 10.32 uri in se je nadaljevala ob 11.08 uri.)</stage>
               <idno>SDZ2-Redna-14-1999-05-27.stage11</idno>
            </item>
            <item>
               <stage>(Seja je bila prekinjena ob 10.32 uri in se je nadaljevala ob 11.32 uri.)</stage>
               <idno>SDZ2-Redna-16-1999-10-29.stage16</idno>
            </item>
            <item>
               <stage>(Seja je bila prekinjena ob 10.32 uri in se je nadaljevala ob 11.39 uri.)</stage>
               <idno>SDZ2-Izredna-49-2000-06-02.stage90</idno>
            </item>
            <item>
               <stage>(Seja je bila prekinjena ob 10.32 uri in se je nadaljevala ob ob 11.32 uri.)</stage>
               <idno>SDZ2-Izredna-16-1997-12-12.stage8</idno>
            </item>
            <item>
               <stage>(Seja je bila prekinjena ob 10.33 uri in se je nadaljevala ob 10.44 uri.)</stage>
               <idno>SDZ2-Redna-10-1999-01-27.stage31</idno>
            </item>
            <item>
               <stage>(Seja je bila prekinjena ob 10.34 uri in se je nadaljevala ob 10.40 uri.)</stage>
               <idno>SDZ2-Izredna-39-1999-09-16.stage20</idno>
            </item>
            <item>
               <stage>(Seja je bila prekinjena ob 10.34 uri in se je nadaljevala ob 10.46 uri.)</stage>
               <idno>SDZ2-Redna-19-2000-02-25.stage41</idno>
            </item>
            <item>
               <stage>(Seja je bila prekinjena ob 10.34 uri in se je nadaljevala ob 10.57 uri.)</stage>
               <idno>SDZ2-Redna-01-1996-11-28.stage15</idno>
            </item>
            <item>
               <stage>(Seja je bila prekinjena ob 10.34 uri in se je nadaljevala ob 11.49 uri.)</stage>
               <idno>SDZ2-Redna-01-1996-12-02.stage11</idno>
            </item>
            <item>
               <stage>(Seja je bila prekinjena ob 10.36 uri in se je nadaljevala ob 10.52 uri.)</stage>
               <idno>SDZ2-Izredna-54-2000-08-30.stage13</idno>
            </item>
            <item>
               <stage>(Seja je bila prekinjena ob 10.36 uri in se je nadaljevala ob 10.55 uri.)</stage>
               <idno>SDZ2-Redna-09-1998-06-11.stage13</idno>
            </item>
            <item>
               <stage>(Seja je bila prekinjena ob 10.36 uri in se je nadaljevala ob 11.23 uri.)</stage>
               <idno>SDZ2-Redna-04-1997-04-23.stage16</idno>
            </item>
            <item>
               <stage>(Seja je bila prekinjena ob 10.37 uri in se je nadaljevala ob 11.35 uri.)</stage>
               <idno>SDZ2-Izredna-25-1998-10-16.stage6</idno>
            </item>
            <item>
               <stage>(Seja je bila prekinjena ob 10.38 uri in se je nadaljevala ob 10.46 uri.)</stage>
               <idno>SDZ2-Redna-17-1999-11-25.stage69</idno>
            </item>
            <item>
               <stage>(Seja je bila prekinjena ob 10.38 uri in se je nadaljevala ob 10.48 uri.)</stage>
               <idno>SDZ2-Izredna-15-1997-10-01.stage9</idno>
            </item>
            <item>
               <stage>(Seja je bila prekinjena ob 10.38 uri in se je nadaljevala ob 10.51 uri.)</stage>
               <idno>SDZ2-Redna-11-1999-02-26.stage49</idno>
            </item>
            <item>
               <stage>(Seja je bila prekinjena ob 10.40 uri in se je nadaljevala ob 10.50 uri.)</stage>
               <idno>SDZ2-Redna-11-1999-02-19.stage11</idno>
            </item>
            <item>
               <stage>(Seja je bila prekinjena ob 10.40 uri in se je nadaljevala ob 10.53 uri.)</stage>
               <idno>SDZ2-Izredna-54-2000-09-01.stage20</idno>
            </item>
            <item>
               <stage>(Seja je bila prekinjena ob 10.40 uri in se je nadaljevala ob 10.55 uri.)</stage>
               <idno>SDZ2-Izredna-52-2000-07-13.stage19</idno>
            </item>
            <item>
               <stage>(Seja je bila prekinjena ob 10.40 uri in se je nadaljevala ob 11.06 uri.)</stage>
               <idno>SDZ2-Redna-10-1998-11-13.stage10</idno>
            </item>
            <item>
               <stage>(Seja je bila prekinjena ob 10.40 uri in se je nadaljevala ob 11.22 uri.)</stage>
               <idno>SDZ2-Redna-08-1998-04-23.stage17</idno>
            </item>
            <item>
               <stage>(Seja je bila prekinjena ob 10.40 uri in se je nadaljevala ob 12.11 uri.)</stage>
               <idno>SDZ2-Izredna-23-1998-07-08.stage31</idno>
            </item>
            <item>
               <stage>(Seja je bila prekinjena ob 10.40 uri in se je nadaljevala ob 12.43 uri.)</stage>
               <idno>SDZ2-Izredna-05-1997-06-06.stage5</idno>
            </item>
            <item>
               <stage>(Seja je bila prekinjena ob 10.43 uri in se je nadaljevala ob 11.03 uri.)</stage>
               <idno>SDZ2-Redna-19-2000-02-23.stage57</idno>
            </item>
            <item>
               <stage>(Seja je bila prekinjena ob 10.43 uri in se je nadaljevala ob 11.50 uri.)</stage>
               <idno>SDZ2-Izredna-28-1998-11-12.stage17</idno>
            </item>
            <item>
               <stage>(Seja je bila prekinjena ob 10.44 uri in se je nadaljevala ob 11.07 uri.)</stage>
               <idno>SDZ2-Izredna-38-1999-07-30.stage64</idno>
            </item>
            <item>
               <stage>(Seja je bila prekinjena ob 10.44 uri in se je nadaljevala ob 11.25 uri.)</stage>
               <idno>SDZ2-Redna-12-1999-03-24.stage12</idno>
            </item>
            <item>
               <stage>(Seja je bila prekinjena ob 10.45 uri in se je nadaljevala ob 10.59 uri.)</stage>
               <idno>SDZ2-Izredna-55-2000-09-14.stage104</idno>
            </item>
            <item>
               <stage>(Seja je bila prekinjena ob 10.45 uri in se je nadaljevala ob 11.42 uri.)</stage>
               <idno>SDZ2-Redna-02-1997-02-19.stage8</idno>
            </item>
            <item>
               <stage>(Seja je bila prekinjena ob 10.45 uri in se je nadaljevala ob 12.43 uri.)</stage>
               <idno>SDZ2-Redna-11-1999-02-18.stage54</idno>
            </item>
            <item>
               <stage>(Seja je bila prekinjena ob 10.46 uri in se je nadaljevala ob 10.57 uri.)</stage>
               <idno>SDZ2-Izredna-37-1999-07-09.stage11 SDZ2-Redna-10-1998-07-24.stage10 SDZ2-Redna-21-2000-04-14.stage34</idno>
            </item>
            <item>
               <stage>(Seja je bila prekinjena ob 10.47 uri in se je nadaljevala bo 11.51 uri.)</stage>
               <idno>SDZ2-Redna-06-1997-07-24.stage7</idno>
            </item>
            <item>
               <stage>(Seja je bila prekinjena ob 10.47 uri in se je nadaljevala ob 11.04 uri.)</stage>
               <idno>SDZ2-Redna-18-2000-02-11.stage26</idno>
            </item>
            <item>
               <stage>(Seja je bila prekinjena ob 10.48 uri in se je nadaljevala ob 10.59 uri.)</stage>
               <idno>SDZ2-Redna-11-1999-02-25.stage13</idno>
            </item>
            <item>
               <stage>(Seja je bila prekinjena ob 10.49 uri in se je nadaljevala ob 11.54 uri.)</stage>
               <idno>SDZ2-Izredna-30-1998-12-18.stage23</idno>
            </item>
            <item>
               <stage>(Seja je bila prekinjena ob 10.50 uri in se je nadaljevala ob 11.00 uri.)</stage>
               <idno>SDZ2-Redna-17-1999-12-15.stage108</idno>
            </item>
            <item>
               <stage>(Seja je bila prekinjena ob 10.51 uri in se je nadaljevala ob 10.54 uri.)</stage>
               <idno>SDZ2-Izredna-28-1998-11-11.stage27</idno>
            </item>
            <item>
               <stage>(Seja je bila prekinjena ob 10.51 uri in se je nadaljevala ob 11.02 uri.)</stage>
               <idno>SDZ2-Redna-08-1998-04-22.stage143</idno>
            </item>
            <item>
               <stage>(Seja je bila prekinjena ob 10.53 uri in se je nadaljevala ob 11.04 uri.)</stage>
               <idno>SDZ2-Izredna-38-1999-07-22.stage74</idno>
            </item>
            <item>
               <stage>(Seja je bila prekinjena ob 10.53 uri in se je nadaljevala ob 11.07 uri.)</stage>
               <idno>SDZ2-Redna-08-1998-02-26.stage10</idno>
            </item>
            <item>
               <stage>(Seja je bila prekinjena ob 10.54 uri in se je nadaljevala ob 11.32 uri.)</stage>
               <idno>SDZ2-Redna-16-1999-10-20.stage43</idno>
            </item>
            <item>
               <stage>(Seja je bila prekinjena ob 10.54 uri in se je nadaljevala ob 11.58 uri.)</stage>
               <idno>SDZ2-Izredna-15-1997-10-01.stage14</idno>
            </item>
            <item>
               <stage>(Seja je bila prekinjena ob 10.55 uri in se je nadaljevala ob 11.16 uri.)</stage>
               <idno>SDZ2-Izredna-12-1997-07-31.stage15</idno>
            </item>
            <item>
               <stage>(Seja je bila prekinjena ob 10.56 uri in se je nadaljevala ob 11.06 uri.)</stage>
               <idno>SDZ2-Redna-13-1999-05-14.stage26</idno>
            </item>
            <item>
               <stage>(Seja je bila prekinjena ob 10.57 uri in se je nadaljevala ob 11.14 uri.)</stage>
               <idno>SDZ2-Redna-09-1998-06-11.stage16</idno>
            </item>
            <item>
               <stage>(Seja je bila prekinjena ob 10.58 uri in se je nadaljevala ob 11.09 uri.)</stage>
               <idno>SDZ2-Redna-19-2000-02-25.stage152</idno>
            </item>
            <item>
               <stage>(Seja je bila prekinjena ob 11.00 uri in se je nadaljevala ob 11.13 uri.)</stage>
               <idno>SDZ2-Izredna-54-2000-09-06.stage53</idno>
            </item>
            <item>
               <stage>(Seja je bila prekinjena ob 11.00 uri in se je nadaljevala ob 11.17 uri.)</stage>
               <idno>SDZ2-Redna-11-1999-02-25.stage15</idno>
            </item>
            <item>
               <stage>(Seja je bila prekinjena ob 11.00 uri in se je nadaljevala ob 11.26 uri.)</stage>
               <idno>SDZ2-Izredna-15-1997-09-30.stage16</idno>
            </item>
            <item>
               <stage>(Seja je bila prekinjena ob 11.01 uri in se je nadaljevala ob 15.49 uri.)</stage>
               <idno>SDZ2-Redna-01-1996-11-28.stage19</idno>
            </item>
            <item>
               <stage>(Seja je bila prekinjena ob 11.02 uri in se je nadaljevala ob 11.12 uri.)</stage>
               <idno>SDZ2-Redna-13-1999-04-28.stage103</idno>
            </item>
            <item>
               <stage>(Seja je bila prekinjena ob 11.02 uri in se je nadaljevala ob 12.02 uri.)</stage>
               <idno>SDZ2-Izredna-28-1998-10-28.stage22</idno>
            </item>
            <item>
               <stage>(Seja je bila prekinjena ob 11.03 uri in se je nadaljevala ob 11.15 uri.)</stage>
               <idno>SDZ2-Redna-08-1998-03-12.stage81</idno>
            </item>
            <item>
               <stage>(Seja je bila prekinjena ob 11.03 uri in se je nadaljevala ob 11.41 uri.)</stage>
               <idno>SDZ2-Izredna-44-2000-04-07.stage5</idno>
            </item>
            <item>
               <stage>(Seja je bila prekinjena ob 11.04 uri in se je nadaljevala ob 11.15 uri.)</stage>
               <idno>SDZ2-Redna-21-2000-04-19.stage32</idno>
            </item>
            <item>
               <stage>(Seja je bila prekinjena ob 11.04 uri in se je nadaljevala ob 11.41 uri.)</stage>
               <idno>SDZ2-Redna-15-1999-06-23.stage16</idno>
            </item>
            <item>
               <stage>(Seja je bila prekinjena ob 11.05 in se je nadaljevala ob 11.32 uri.)</stage>
               <idno>SDZ2-Redna-17-1999-12-03.stage52</idno>
            </item>
            <item>
               <stage>(Seja je bila prekinjena ob 11.05 uri in se je nadaljevala ob 11.20 uri.)</stage>
               <idno>SDZ2-Izredna-23-1998-07-17.stage6</idno>
            </item>
            <item>
               <stage>(Seja je bila prekinjena ob 11.05 uri in se je nadaljevala ob 11.30 uri.)</stage>
               <idno>SDZ2-Redna-04-1997-04-22.stage17</idno>
            </item>
            <item>
               <stage>(Seja je bila prekinjena ob 11.06 uri in se je nadaljevala ob 11.17 uri.)</stage>
               <idno>SDZ2-Redna-11-1999-02-26.stage75</idno>
            </item>
            <item>
